id,name,title,cost,inkwell,attack,defence,color,type,action,flavour,separator,stars,illustrator,card_set_id,language,number,pack,rarity,image,blurhash,franchise_id,final,spoiler,created_at,updated_at,traits,prices,franchise,languages
106,Zeus,God of Lightning,4,0,0,4,5,glimmer,"<b>Rush</b> <i>(This character can challenge the turn they're played.)</i><br /><b>Challenger</b> +4 (<i>When challenging, this character get +4 ※.</i>)",“A little lightning solves a whole lot of problems.”,pen,2,Koni,2,EN,61,204,rare,https://images.lorcania.com/cards/tfc/61_en_zeus-716.webp,,9,1,0,2023-06-28T18:05:42.000000Z,2023-06-28T18:05:42.000000Z,"['Deity', 'Storyborn']",1.99,"{'id': 9, 'name': 'Hercules', 'slug': 'hercules', 'brand': None, 'image': 'https://images.lorcania.com/site%2Ffranchises%2FHercules.png'}","{'EN': {'card_id': 106, 'language': 'EN', 'name': 'Zeus', 'title': 'God of Lightning', 'action': ""<b>Rush</b> <i>(This character can challenge the turn they're played.)</i><br /><b>Challenger</b> +4 (<i>When challenging, this character get +4 ※.</i>)"", 'flavour': '“A little lightning solves a whole lot of problems.”', 'image': 'https://images.lorcania.com/cards/tfc/61_en_zeus-716.webp'}, 'DE': {'card_id': 106, 'language': 'DE', 'name': 'Zeus', 'title': 'Gott der Blitze', 'action': '<b>Rasant</b> <i>(Dieser Charakter kann im selben Zug herausfordern, in dem er ausgespielt wird.)</i><br /><b>Herausfordern</b> +4 (<i>Während dieser Charakter herausfordert, erhält er +4 ※.</i>)', 'flavour': '„Ein kleiner Blitz löst eine ganze Menge Probleme“', 'image': 'https://images.lorcania.com/cards/tfc/61_de_zeus-716.webp'}, 'FR': {'card_id': 106, 'language': 'FR', 'name': 'Zeus', 'title': 'Dieu de la Foudre', 'action': ""<b>Charge</b> <i>(Ce personnage peut défier le tour où il est joué.)</i><br /><b>Offensif</b> +4 (<i>Lorsqu'il défie, ce personnage gagne +4 ※.</i>)"", 'flavour': '""Un petit éclair peut résoudre bien des problèmes.""', 'image': 'https://images.lorcania.com/cards/tfc/61_fr_zeus-716.webp'}}"
107,Donald Duck,Strutting His Stuff,5,1,4,3,2,glimmer,<b>Ward</b> (Opponents can't choose this character except to challenge.),"Walk smarter, not harder.",pen,2,Cam Kendell,2,EN,144,204,common,https://images.lorcania.com/cards/tfc/144_en_donald_duck-716.webp,,1,1,0,2023-06-30T18:23:18.000000Z,2023-06-30T18:23:18.000000Z,"['Dreamborn', 'Hero', 'Inventor']",0.25,"{'id': 1, 'name': 'Micky Mouse and Friends', 'slug': 'micky-mouse-and-friends', 'brand': None, 'image': 'https://images.lorcania.com/site%2Ffranchises%2FMickey_Mouse_and_Friends.png'}","{'EN': {'card_id': 107, 'language': 'EN', 'name': 'Donald Duck', 'title': 'Strutting His Stuff', 'action': ""<b>Ward</b> (Opponents can't choose this character except to challenge.)"", 'flavour': 'Walk smarter, not harder.', 'image': 'https://images.lorcania.com/cards/tfc/144_en_donald_duck-716.webp'}, 'DE': {'card_id': 107, 'language': 'DE', 'name': 'Donald Duck', 'title': 'Stolziert umher', 'action': '<b>Behütet</b> (Gegnerische Karten können diesen Charakter nicht auswählen, außer um ihn herauszufordern.)', 'flavour': 'Bewege dich schlauer, nicht schneller', 'image': 'https://images.lorcania.com/cards/tfc/144_de_donald_duck-716.webp'}, 'FR': {'card_id': 107, 'language': 'FR', 'name': 'Donald Duck', 'title': 'Inventeur fanfaron', 'action': ""<b>Hors d'atteinte</b> (Les adversaires ne peuvent pas\nchoisir ce personnage, hormis pour un défi.)"", 'flavour': 'Marcher malin, aller plus loin...et travailler moins !', 'image': 'https://images.lorcania.com/cards/tfc/144_fr_donald_duck-716.webp'}}"
108,Merlin,Self-Appointed Mentor,4,1,3,4,2,glimmer,"<b>Support</b> <i>(Whenever this character quests, you may add their ※ to another chosen character‘s ※ this turn.)</i>",“What a mess! What a medieval muddle! We'll have to modernize it.”,book,1,Dave Beauchene,2,EN,153,204,common,https://images.lorcania.com/cards/tfc/153_en_merlin-716.webp,,23,1,0,2023-07-05T13:23:48.000000Z,2023-07-05T13:23:48.000000Z,"['Dreamborn', 'Mentor', 'Sorcerer']",0.25,"{'id': 23, 'name': 'The Sword in the Stone', 'slug': 'the-sword-in-the-stone', 'brand': None, 'image': 'https://images.lorcania.com/site/franchises/The_Sword_in_the_Stone.png'}","{'EN': {'card_id': 108, 'language': 'EN', 'name': 'Merlin', 'title': 'Self-Appointed Mentor', 'action': '<b>Support</b> <i>(Whenever this character quests, you\x03 may add their ※ to another chosen character‘s ※ this turn.)</i>', 'flavour': ""“What a mess! What a medieval muddle! We'll have to modernize it.”"", 'image': 'https://images.lorcania.com/cards/tfc/153_en_merlin-716.webp'}, 'DE': {'card_id': 108, 'language': 'DE', 'name': 'Merlin', 'title': 'Selbsternannter Mentor', 'action': '<b>Unterstützen</b> <i>(Jedes Mal, wenn dieser Charakter erkundet, darfst du seine ※ in diesem Zug zur ※ eines anderen Charakters deiner Wahl addieren.)</i>', 'flavour': '„Was für eine mittelalterliche Wirtschaft. Das werden wir jetzt modernisieren.“', 'image': 'https://images.lorcania.com/cards/tfc/153_de_merlin-716.webp'}, 'FR': {'card_id': 108, 'language': 'FR', 'name': 'Merlin', 'title': 'Mentor autoproclamé', 'action': ""<b>Soutien</b> <i>(Lorsque ce personnage est envoyé à l'aventure, vous pouvez ajouter sa ※ à la ※d'un\nautre personnage au choix pour le reste de ce tour.)</i>"", 'flavour': ""“Quelle pagaille ! Quelle crasse médiévale ! Moustique, il faut qu'on modernise ça.”"", 'image': 'https://images.lorcania.com/cards/tfc/153_fr_merlin-716.webp'}}"
109,Befuddle,,1,1,,,5,action,Return a character or item with cost 2 or less to their player's hand.,Never be afraid to have your mind boggled now and then.,pen,0,Kendall Hale,2,EN,62,204,uncommon,https://images.lorcania.com/cards/tfc/62_en_befuddle-716.webp,,23,1,0,2023-07-06T14:08:07.000000Z,2023-07-06T14:08:07.000000Z,['Action'],1.19,"{'id': 23, 'name': 'The Sword in the Stone', 'slug': 'the-sword-in-the-stone', 'brand': None, 'image': 'https://images.lorcania.com/site/franchises/The_Sword_in_the_Stone.png'}","{'EN': {'card_id': 109, 'language': 'EN', 'name': 'Befuddle', 'title': None, 'action': ""Return a character or item with cost 2 or less to their player's hand."", 'flavour': 'Never be afraid to have your mind boggled now and then.', 'image': 'https://images.lorcania.com/cards/tfc/62_en_befuddle-716.webp'}, 'DE': {'card_id': 109, 'language': 'DE', 'name': 'Das meistbeirrende Spiel', 'title': None, 'action': 'Schicke einen Charakter oder Gegenstand deiner Wahl, der 2 oder weniger kostet, auf die zugehörige Hand zurück.', 'flavour': 'Hab keine Angst davor, deinen Verstand hin und wieder\nverwirren zu lassen.', 'image': 'https://images.lorcania.com/cards/tfc/62_de_befuddle-716.webp'}, 'FR': {'card_id': 109, 'language': 'FR', 'name': 'Emberlificotage', 'title': None, 'action': 'Renvoyez un personnage ou un objet coûtant 2 ou moins\ndans la main de son propriétaire.', 'flavour': ""Ne sois pas effrayé d'être stupéfait de temps en temps."", 'image': 'https://images.lorcania.com/cards/tfc/62_fr_befuddle-716.webp'}}"
110,Tinker Bell,Giant Fairy,6,1,4,5,6,glimmer,"<b>Shift</b> 4 (<i>You may pay 4 ⬡ to play this on top of one of your characters named Tinker Bell.</i>)<br /><mark>ROCK THE BOAT</mark> When you play this character, deal 1 damage to each opposing character.<br /><mark>PUNY PIRATE!</mark> During your turn, whenever this character banishes another character in a challenge, you may deal 2 damage to chosen opposing character.",,,2,Cookie,2,EN,193,204,super_rare,https://images.lorcania.com/cards/tfc/193_en_tinker_bell-716.webp,,7,1,0,2023-07-06T14:12:05.000000Z,2023-07-06T14:12:05.000000Z,"['Floodborn', 'Ally', 'Fairy']",28,"{'id': 7, 'name': 'Peter Pan', 'slug': 'peter-pan', 'brand': None, 'image': 'https://images.lorcania.com/site%2Ffranchises%2FPeter_Pan.png'}","{'EN': {'card_id': 110, 'language': 'EN', 'name': 'Tinker Bell', 'title': 'Giant Fairy', 'action': '<b>Shift</b> 4 (<i>You may pay 4 ⬡ to play this on top of one of your characters named Tinker Bell.</i>)<br /><mark>ROCK THE BOAT</mark> When you play this character, deal 1 damage to each opposing character.<br />\n<mark>PUNY PIRATE!</mark> During your turn, whenever this character banishes another character in a challenge, you may deal 2 damage to chosen opposing character.', 'flavour': None, 'image': 'https://images.lorcania.com/cards/tfc/193_en_tinker_bell-716.webp'}, 'DE': {'card_id': 110, 'language': 'DE', 'name': 'Naseweis', 'title': 'Gigantische Fee', 'action': '<b>Gestaltwandel</b> 4 (<i>Du kannst 4 ⬡ zahlen, um diesen Charakter\nauf einen deiner Naseweis-Charaktere auszuspielen.)</i><br /><mark>FLUTWELLE</mark> Wenn du diesen Charakter ausspielst, füge\njedem gegnerischen Charakter 1 Schaden zu.<br />\n<mark>MICKRIGER PIRAT!</mark> Jedes Mal, wenn dieser Charakter in deinem Zug einen anderen Charakter durch eine Herausforderung verbannt, darfst du einem gegnerischen Charakter deiner Wahl 2 Schaden zufügen.', 'flavour': None, 'image': 'https://images.lorcania.com/cards/tfc/193_de_tinker_bell-716.webp'}, 'FR': {'card_id': 110, 'language': 'FR', 'name': 'La Fée Clochette', 'title': 'Fée géante', 'action': '<b>Alter</b> 4 (<i>Vous pouvez payer 4 ⬡ pour jouer ce personnage sur un autre personnage Clochette</i>)<br /><mark>SECOUE LE BATEAU</mark> Lorsque vous jouez ce personnage, infligez 1 dommage à chaque personnage adverse.<br />\n<mark>PETIT PIRATE!</mark> Lorsque ce personnage en bannit un autre via un défi durant votre tour, vous pouvez choisir un personnage adverse et lui infliger 2 dommages.', 'flavour': None, 'image': 'https://images.lorcania.com/cards/tfc/193_fr_tinker_bell-716.webp'}}"
111,Simba,Protective Cub,2,1,2,3,4,glimmer,<b>Bodyguard</b> <i>(This character may enter play exerted. An opposing character who challenges one of your characters must choose one with Bodyguard if able.)</i>,Courage comes in all sizes.,pen,1,Filipe Laurentino,2,EN,20,204,common,https://images.lorcania.com/cards/tfc/20_en_simba-716.webp,,12,1,0,2023-07-06T14:18:14.000000Z,2023-07-06T14:18:14.000000Z,"['Storyborn', 'Hero', 'Prince']",3.38,"{'id': 12, 'name': 'The Lion King', 'slug': 'the-lion-king', 'brand': None, 'image': 'https://images.lorcania.com/site%2Ffranchises%2FLion_King.png'}","{'EN': {'card_id': 111, 'language': 'EN', 'name': 'Simba', 'title': 'Protective Cub', 'action': '<b>Bodyguard</b> <i>(This character may enter play exerted. An opposing character who challenges one of your characters must choose one with Bodyguard if able.)</i>', 'flavour': 'Courage comes in all sizes.', 'image': 'https://images.lorcania.com/cards/tfc/20_en_simba-716.webp'}, 'DE': {'card_id': 111, 'language': 'DE', 'name': 'Simba', 'title': 'Schützender Welpe', 'action': '<b>Beschützen</b> <i>(Du darfst diesen Charakter erschöpft\nausspielen. Gegnerische Charaktere müssen\nbeim Herausfordern zuerst deine Charaktere mit\nBeschützen wählen, wenn möglich.)</i>', 'flavour': 'Mut gibt es in allen Größen.', 'image': 'https://images.lorcania.com/cards/tfc/20_de_simba-716.webp'}, 'FR': {'card_id': 111, 'language': 'FR', 'name': 'Simba', 'title': 'Lionceau protecteur', 'action': ""<b>Rempart</b> <i>(Ce personnage peut entrer en jeu\népuisé. Lorsqu'il vous défie, un personnage adverse\ndoit, si possible, choisir l'un de vos personnages\navec Rempart.)</i>"", 'flavour': 'Le courage ne dépend pas de la taille.', 'image': 'https://images.lorcania.com/cards/tfc/20_fr_simba-716.webp'}}"
112,Kronk,Right-Hand Man,6,1,6,6,6,glimmer,,“Oh yeah. It's all coming together!”,book,2,Jake Parker,2,EN,183,204,uncommon,https://images.lorcania.com/cards/tfc/183_en_kronk-716.webp,,20,1,0,2023-07-07T15:02:26.000000Z,2023-07-07T15:02:26.000000Z,"['Ally', 'Storyborn']",0.75,"{'id': 20, 'name': ""The Emperor's New Groove"", 'slug': 'the-emperors-new-groove', 'brand': None, 'image': 'https://images.lorcania.com/site/franchises/Emperors_New_Groove.png'}","{'EN': {'card_id': 112, 'language': 'EN', 'name': 'Kronk', 'title': 'Right-Hand Man', 'action': None, 'flavour': ""“Oh yeah. It's all coming together!”"", 'image': 'https://images.lorcania.com/cards/tfc/183_en_kronk-716.webp'}, 'DE': {'card_id': 112, 'language': 'DE', 'name': 'Kronk', 'title': 'Rechte Hand', 'action': None, 'flavour': '„Oh ja, es kommt alles zusammen!“', 'image': 'https://images.lorcania.com/cards/tfc/183_de_kronk-716.webp'}, 'FR': {'card_id': 112, 'language': 'FR', 'name': 'Kronk', 'title': 'Fidèle bras droit', 'action': None, 'flavour': '""Oh oui, tous les morceaux se recollent.""', 'image': 'https://images.lorcania.com/cards/tfc/183_fr_kronk-716.webp'}}"
113,Pongo,Ol' Rascal,4,1,2,3,1,glimmer,<b>Evasive</b> (<i>Only characters with Evasive can challenge this character.</i>),"“At first I had no particular plan, just anything to attract attention. You know, stir things up a bit.”",book,2,Brian Weisz,2,EN,120,204,common,https://images.lorcania.com/cards/tfc/120_en_pongo-716.webp,,4,1,0,2023-07-07T18:50:11.000000Z,2023-07-07T18:50:11.000000Z,"['Hero', 'Storyborn']",0.25,"{'id': 4, 'name': '101 Dalmatians', 'slug': '101-dalmatians', 'brand': None, 'image': 'https://images.lorcania.com/site%2Ffranchises%2F101_Dalmatiner.png'}","{'EN': {'card_id': 113, 'language': 'EN', 'name': 'Pongo', 'title': ""Ol' Rascal"", 'action': '<b>Evasive</b> (<i>Only characters with Evasive can challenge this character.</i>)', 'flavour': '“At first I had no particular plan, just anything to attract attention. You know, stir things up a bit.”', 'image': 'https://images.lorcania.com/cards/tfc/120_en_pongo-716.webp'}, 'DE': {'card_id': 113, 'language': 'DE', 'name': 'Pongo', 'title': 'Alter Gauner', 'action': '<b>Wendig</b> (<i>Nur Charaktere mit Wendig können diesen Charakter herausfordern.</i>)', 'flavour': '„Nun brauche ich nur noch einen Einfall, irgendetwas, das seine Aufmerksamkeit erregen würde, damit die Geschichte in Gang kommt.“', 'image': 'https://images.lorcania.com/cards/tfc/120_de_pongo-716.webp'}, 'FR': {'card_id': 113, 'language': 'FR', 'name': 'Pongo', 'title': 'Sacripant', 'action': '<b>Insaisissable</b> (<i>Seuls les personnages avec\nInsaisissable peuvent défier ce personnage.</i>)', 'flavour': '""A vrai dire, je n\'avais établi aucun plan… enfin je…, je cherchais à attirer l\'attention. Vous savez… histoire de créer une ambiance.""', 'image': 'https://images.lorcania.com/cards/tfc/120_fr_pongo-716.webp'}}"
114,Lilo,Making a Wish,1,0,1,1,4,glimmer,,“A falling star . . . I have to make a wish!”,book,2,Dave Beauchene,2,EN,9,204,rare,https://images.lorcania.com/cards/tfc/9_en_lilo-716.webp,,2,1,0,2023-07-09T21:31:36.000000Z,2023-07-09T21:31:36.000000Z,"['Hero', 'Storyborn']",25,"{'id': 2, 'name': 'Lilo and Stitch', 'slug': 'lilo-and-stitch', 'brand': None, 'image': 'https://images.lorcania.com/site%2Ffranchises%2FLilo_and_Stitch.png'}","{'EN': {'card_id': 114, 'language': 'EN', 'name': 'Lilo', 'title': 'Making a Wish', 'action': None, 'flavour': '“A falling star . . . I have to make a wish!”', 'image': 'https://images.lorcania.com/cards/tfc/9_en_lilo-716.webp'}, 'DE': {'card_id': 114, 'language': 'DE', 'name': 'Lilo', 'title': 'Wünscht sich was', 'action': None, 'flavour': '„Eine Sternschnuppe! Zuerst gesehen! Raus, geh raus! Ich muss mir was wünschen!”', 'image': 'https://images.lorcania.com/cards/tfc/9_de_lilo-716.webp'}, 'FR': {'card_id': 114, 'language': 'FR', 'name': 'Lilo', 'title': 'Faisant un voeu', 'action': None, 'flavour': '""Une étoile filaaante ! J\'l\'ai vue la première ! Sors, sors vite, je dois faire un voeu !""', 'image': 'https://images.lorcania.com/cards/tfc/9_fr_lilo-716.webp'}}"
115,Flotsam,Ursula's Spy,5,0,3,4,5,glimmer,<b>Rush</b> <i>(This character can challenge the turn they're played.)</i><br /><mark>DEXTEROUS LUNGE</mark> Your characters named Jetsam gain <b>Rush.</b>,“We know someone who can help you . . . for a price.”,pen,2,Luis Huerta,2,EN,43,204,rare,https://images.lorcania.com/cards/tfc/43_en_flotsam-716.webp,,21,1,0,2023-07-10T16:27:19.000000Z,2023-07-10T16:27:19.000000Z,"['Ally', 'Storyborn']",0.69,"{'id': 21, 'name': 'The Little Mermaid', 'slug': 'the-little-mermaid', 'brand': None, 'image': 'https://images.lorcania.com/site/franchises/The_Little_Mermaid.png'}","{'EN': {'card_id': 115, 'language': 'EN', 'name': 'Flotsam', 'title': ""Ursula's Spy"", 'action': ""<b>Rush</b> <i>(This character can challenge the turn they're played.)</i><br /><mark>DEXTEROUS LUNGE</mark> Your characters named Jetsam gain <b>Rush.</b>"", 'flavour': '“We know someone who can help you . . . for a price.”', 'image': 'https://images.lorcania.com/cards/tfc/43_en_flotsam-716.webp'}, 'DE': {'card_id': 115, 'language': 'DE', 'name': 'Abschaum', 'title': 'Ursulas Spion', 'action': '<b>Rasant</b> <i>(Dieser Charakter kann im selben Zug herausfordern, in dem er ausgespielt wird.)</i><br /><mark>FLINK UND HINTERHÄLTIG</mark> Deine Meerschaum-Charaktere erhalten <b>Rasant.</b>', 'flavour': '„Wir kennen jemanden, der dir helfen kann ... zu einem bestimmten Preis.“', 'image': 'https://images.lorcania.com/cards/tfc/43_de_flotsam-716.webp'}, 'FR': {'card_id': 115, 'language': 'FR', 'name': 'Flotsam', 'title': ""Espion d'Ursula"", 'action': '<b>Charge</b> <i>(Ce personnage peut défier le tour où il est joué.)</i><br /><mark>COUP BAS</mark> Vos personnages Jetsam gagnent  <b>Charge</b>.', 'flavour': '""Nous connaissons quelqu\'un qui t\'aider...à certaines conditions.""', 'image': 'https://images.lorcania.com/cards/tfc/43_fr_flotsam-716.webp'}}"
116,Jetsam,Ursula's Spy,4,1,3,3,5,glimmer,<b>Evasive</b> <i>(Only characters with Evasive can challenge this character.)</i><br /><mark>SINISTER SLITHER</mark> Your characters named Flotsam gain <b>Evasive.</b>,“We can help you get anything you want. . . .”,pen,1,Brian Weisz,2,EN,46,204,common,https://images.lorcania.com/cards/tfc/46_en_jetsam-716.webp,,21,1,0,2023-07-10T16:31:23.000000Z,2023-07-10T16:31:23.000000Z,"['Ally', 'Storyborn']",0.25,"{'id': 21, 'name': 'The Little Mermaid', 'slug': 'the-little-mermaid', 'brand': None, 'image': 'https://images.lorcania.com/site/franchises/The_Little_Mermaid.png'}","{'EN': {'card_id': 116, 'language': 'EN', 'name': 'Jetsam', 'title': ""Ursula's Spy"", 'action': '<b>Evasive</b> <i>(Only characters with Evasive can challenge this character.)</i><br /><mark>SINISTER SLITHER</mark> Your characters named Flotsam gain <b>Evasive.</b>', 'flavour': '“We can help you get anything you want. . . .”', 'image': 'https://images.lorcania.com/cards/tfc/46_en_jetsam-716.webp'}, 'DE': {'card_id': 116, 'language': 'DE', 'name': 'Meerschaum', 'title': 'Ursulas Spion', 'action': '<b>Wendig</b> <i>(Nur Charaktere mit Wendig können diesen Charakter herausfordern.)</i><br /><mark>FIES UND GLITSCHIG</mark> Deine Abschaum-Charaktere erhalten <b>Wendig.</b>', 'flavour': '„Wir können dir helfen, alles zu bekommen, was du willst.“', 'image': 'https://images.lorcania.com/cards/tfc/46_de_jetsam-716.webp'}, 'FR': {'card_id': 116, 'language': 'FR', 'name': 'Jetsam', 'title': ""Espion d'Ursula"", 'action': '<b>Insaisissable</b> <i>(Seuls les personnages avec Insaisissable peuvent défier ce personnage.)</i><br /><mark>SINISTRE ONDULATION</mark> Vos personnages Flotsam gagnent <b>Insaisissable</b>.', 'flavour': ""“Nous pouvons t'aider à obtenir tout ce que tu désires”"", 'image': 'https://images.lorcania.com/cards/tfc/46_fr_jetsam-716.webp'}}"
117,Triton,The Sea King,7,1,5,9,2,glimmer,,“Isn't ‘Because I said so’ enough of a reason?”,pen,2,Cristian Romero,2,EN,160,204,uncommon,https://images.lorcania.com/cards/tfc/160_en_triton-716.webp,,21,1,0,2023-07-11T16:45:33.000000Z,2023-07-11T16:45:33.000000Z,"['King', 'Storyborn']",0.36,"{'id': 21, 'name': 'The Little Mermaid', 'slug': 'the-little-mermaid', 'brand': None, 'image': 'https://images.lorcania.com/site/franchises/The_Little_Mermaid.png'}","{'EN': {'card_id': 117, 'language': 'EN', 'name': 'Triton', 'title': 'The Sea King', 'action': None, 'flavour': ""“Isn't ‘Because I said so’ enough of a reason?”"", 'image': 'https://images.lorcania.com/cards/tfc/160_en_triton-716.webp'}, 'DE': {'card_id': 117, 'language': 'DE', 'name': 'Triton', 'title': 'König Triton', 'action': None, 'flavour': '„Ist ‚Weil ich es sage‘ nicht Grund genug?“', 'image': 'https://images.lorcania.com/cards/tfc/160_de_triton-716.webp'}, 'FR': {'card_id': 117, 'language': 'FR', 'name': 'Triton', 'title': 'Roi des Océans', 'action': None, 'flavour': '""Parce que je l\'ai dit  ! N\'est-ce pas suffisant comme raison ?""', 'image': 'https://images.lorcania.com/cards/tfc/160_fr_triton-716.webp'}}"
118,Grab Your Sword,,5,0,,,6,song,<i>(A character with cost 5 or more can ↷ to sing this song for free.)</i><br />Deal 2 damage to each opposing character.,"We don't likewhat we don't understandIn fact, it scares us",clef,0,Peter Brockhammer,2,EN,198,204,rare,https://images.lorcania.com/cards/tfc/198_en_grab_your_sword-716.webp,,14,1,0,2023-07-11T21:19:51.000000Z,2023-07-11T21:19:51.000000Z,"['Action', 'Song']",6.02,"{'id': 14, 'name': 'Beauty & the Beast', 'slug': 'beauty-and-the-beast', 'brand': None, 'image': 'https://images.lorcania.com/site%2Ffranchises%2FBeauty_and_the_Beast.png'}","{'EN': {'card_id': 118, 'language': 'EN', 'name': 'Grab Your Sword', 'title': None, 'action': '<i>(A character with cost 5 or more can ↷ to sing this song for free.)</i><br />Deal 2 damage to each opposing character.', 'flavour': ""We don't like\nwhat we don't understand\nIn fact, it scares us"", 'image': 'https://images.lorcania.com/cards/tfc/198_en_grab_your_sword-716.webp'}, 'DE': {'card_id': 118, 'language': 'DE', 'name': 'Nehmt das Schwert', 'title': None, 'action': '<i>(Du kannst einen Charakter, der 5 oder mehr kostet, ↷, damit er dieses Lied kostenlos singt.)</i><br />Füge jedem gegnerischen Charakter 2 Schaden zu.', 'flavour': ""Wir versteh'n das zwar nicht, doch dies Monster ist so schrecklich, dass das Blut in unseren Adern kaum noch fließt."", 'image': 'https://images.lorcania.com/cards/tfc/198_de_grab_your_sword-716.webp'}, 'FR': {'card_id': 118, 'language': 'FR', 'name': 'Tuons la Bête', 'title': None, 'action': '<i>( Vous pouvez ↷ un personnage coûtant 5 ou plus pour chanter cette chanson gratuitement.)</i><br />Infligez 2 dommages à chaque personnage adverse.', 'flavour': ""L'inconnu nous effraie, l'imprévu nous terrorise. Et cette chose mystérieuse nous inquiète. Compagnons, à vos armes !"", 'image': 'https://images.lorcania.com/cards/tfc/198_fr_grab_your_sword-716.webp'}}"
119,Anna,Heir to Arendelle,4,1,2,4,5,glimmer,"<mark>LOVING HEART</mark> When you play this character, if you have a character named Elsa in play, choose an opposing character. The chosen character doesn't ready at the start of their next turn.","“Two sisters, one mind.”",book,2,Valerio Buonfantino,2,EN,35,204,uncommon,https://images.lorcania.com/cards/tfc/35_en_anna-716.webp,,3,1,0,2023-07-13T17:28:20.000000Z,2023-07-13T17:28:20.000000Z,"['Hero', 'Storyborn', 'Queen']",0.5,"{'id': 3, 'name': 'Frozen', 'slug': 'frozen', 'brand': None, 'image': 'https://images.lorcania.com/site%2Ffranchises%2FFrozen.png'}","{'EN': {'card_id': 119, 'language': 'EN', 'name': 'Anna', 'title': 'Heir to Arendelle', 'action': ""<mark>LOVING HEART</mark> When you play this character, if you have a character named Elsa in play, choose an opposing character. The chosen character doesn't ready at the start of their next turn."", 'flavour': '“Two sisters, one mind.”', 'image': 'https://images.lorcania.com/cards/tfc/35_en_anna-716.webp'}, 'DE': {'card_id': 119, 'language': 'DE', 'name': 'Anna', 'title': 'Thronfolgerin von Arendelle', 'action': '<mark>LIEBEVOLLES HERZ</mark> Wenn du diesen Charakter ausspielst und einen Elsa-Charakter im Spiel hast, wähle einen gegnerischen Charakter. Er wird zu Beginn seines nächsten Zuges nicht bereit gemacht.', 'flavour': '„Zwei Schwestern, ein Gedanke“', 'image': 'https://images.lorcania.com/cards/tfc/35_de_anna-716.webp'}, 'FR': {'card_id': 119, 'language': 'FR', 'name': 'Anna', 'title': ""Héritière d'Arendelle"", 'action': '<mark>AMOUR SINCERE</mark>. Si vous avez un personnage Elsa en jeu lorsque vous jouez ce personnage, vous pouvez choisir un personnage adverse. Celui-ci ne sera pas redressé au début de son prochain tour.', 'flavour': '""Deux soeurs, deux âmes synchronisées.""', 'image': 'https://images.lorcania.com/cards/tfc/35_fr_anna-716.webp'}}"
