id,name,title,cost,inkwell,attack,defence,color,type,action,flavour,separator,stars,illustrator,card_set_id,language,number,pack,rarity,image,blurhash,franchise_id,final,spoiler,created_at,updated_at,traits,prices,franchise,languages
206,Philoctetes,Trainer of Heroes,2,1,3,1,2,glimmer,"<b>Support</b> <i>(Whenever this character quests, you may add their ※ to another chosen character‘s ※ this turn.)</i>",“Ya gotta be the best to train the best. And I train the best!”,pen,1,Leonardo Giammichele,2,EN,156,204,common,https://images.lorcania.com/cards/tfc/156_en_philoctetes-716.webp,,9,1,0,2023-07-25T17:12:05.000000Z,2023-07-25T17:12:05.000000Z,"['Mentor', 'Storyborn']",0.27,"{'id': 9, 'name': 'Hercules', 'slug': 'hercules', 'brand': None, 'image': 'https://images.lorcania.com/site%2Ffranchises%2FHercules.png'}","{'EN': {'card_id': 206, 'language': 'EN', 'name': 'Philoctetes', 'title': 'Trainer of Heroes', 'action': '<b>Support</b> <i>(Whenever this character quests, you\x03 may add their ※ to another chosen character‘s ※ this turn.)</i>', 'flavour': '“Ya gotta be the best to train the best. And I train the best!”', 'image': 'https://images.lorcania.com/cards/tfc/156_en_philoctetes-716.webp'}, 'DE': {'card_id': 206, 'language': 'DE', 'name': 'Phil', 'title': 'Trainer der Helden', 'action': '<b>Unterstützen</b> <i>(Jedes Mal, wenn dieser Charakter erkundet, darfst du seine ※ in diesem Zug zur ※ eines anderes Charakters deiner Wahl addieren.)</i>', 'flavour': '„Man muss der Beste sein, um die Besten zu trainieren. Und ich trainiere die Besten!“', 'image': 'https://images.lorcania.com/cards/tfc/156_de_philoctetes-716.webp'}, 'FR': {'card_id': 206, 'language': 'FR', 'name': 'Philoctète', 'title': None, 'action': ""<b>Soutien</b> <i>(Lorsque ce personnage est envoyé à l'aventure, vous pouvez ajouter sa ※ à celle d'un autre personnage au choix pour le reste de ce tour.)</i>"", 'flavour': '""Il faut être le meilleur pour entraîner les meilleurs. Et j\'entraîne les meilleurs !""', 'image': 'https://images.lorcania.com/cards/tfc/156_fr_philoctetes-716.webp'}}"
207,Tamatoa,So Shiny!,8,1,5,8,2,glimmer,"<mark>WHAT HAVE WE HERE?</mark> When you play this character and whenever he quests, you may return an item card from your discard to your hand.<br /><mark>GLAM</mark> This character gets +1 ◆ for each item you have in play.",“Watch me dazzle like a diamond in the rough!”,book,1,Leonardo Giammichele,2,EN,159,204,super_rare,https://images.lorcania.com/cards/tfc/159_en_tamatoa-716.webp,,11,1,0,2023-07-25T17:13:49.000000Z,2023-07-25T17:13:49.000000Z,"['Storyborn', 'Villain']",3.78,"{'id': 11, 'name': 'Moana', 'slug': 'moana', 'brand': None, 'image': 'https://images.lorcania.com/site%2Ffranchises%2FMoana.png'}","{'EN': {'card_id': 207, 'language': 'EN', 'name': 'Tamatoa', 'title': 'So Shiny!', 'action': '<mark>WHAT HAVE WE HERE?</mark> When you play this character and whenever he quests, you may return an item card from your discard to your hand.<br />\n<mark>GLAM</mark> This character gets +1 ◆ for each item you have in play.', 'flavour': '“Watch me dazzle like a diamond in the rough!”', 'image': 'https://images.lorcania.com/cards/tfc/159_en_tamatoa-716.webp'}, 'DE': {'card_id': 207, 'language': 'DE', 'name': 'Tamatoa', 'title': 'So glänzend!', 'action': '<mark>WAS HABEN WIR DENN DA?</mark> WEnn du diesen Charakter ausspielst und jedes Mal, wenn er erkundet, darfst du 1 Gegenstandskarte aus deinem Ablagestapel zurück auf deine Hand nehmen.<br />\n<mark>GLAMURÖS</mark> Dieser Charakter erhält +1 ◆ für jeden Gegenstand, den du im Spiel hast.', 'flavour': ""„Ich bin glänzend, funkle wie ein ungeschliff'ner Diamant.“"", 'image': 'https://images.lorcania.com/cards/tfc/159_de_tamatoa-716.webp'}, 'FR': {'card_id': 207, 'language': 'FR', 'name': 'Tamatoa', 'title': None, 'action': ""<mark>MAIS QU'AVONS NOUS LA?</mark> Lorsque vous jouez ce personnage ou qu'il est envoyé à l'aventure, vous pouvez reprendre en main une carte objet de votre défausse.<br />\n<mark>SPLENDIDE</mark> Ce personnage a +1 ◆ pour chaque objet que vous avez en jeu."", 'flavour': '""Je suis fier d\'être bling-bling, comme un diamant au milieu de l\'océan.""', 'image': 'https://images.lorcania.com/cards/tfc/159_fr_tamatoa-716.webp'}}"
208,Eye of the Fates,,4,1,,,2,item,<mark>SEE THE FUTURE</mark> ↷ − Chosen character gets +1 ◆ this turn.,You can change the future once you know what you're looking at.,pen,0,Ron Baird,2,EN,167,204,uncommon,https://images.lorcania.com/cards/tfc/167_en_eye_of_the_fates-716.webp,,9,1,0,2023-07-25T17:16:28.000000Z,2023-07-25T17:16:28.000000Z,['Item'],0.72,"{'id': 9, 'name': 'Hercules', 'slug': 'hercules', 'brand': None, 'image': 'https://images.lorcania.com/site%2Ffranchises%2FHercules.png'}","{'EN': {'card_id': 208, 'language': 'EN', 'name': 'Eye of the Fates', 'title': None, 'action': '<mark>SEE THE FUTURE</mark> ↷ − Chosen character gets +1 ◆ this turn.', 'flavour': ""You can change the future once you know what you're looking at."", 'image': 'https://images.lorcania.com/cards/tfc/167_en_eye_of_the_fates-716.webp'}, 'DE': {'card_id': 208, 'language': 'DE', 'name': 'Auge der Moiren', 'title': None, 'action': '<mark>DIE ZUKUNFT OFFENBAREN</mark> ↷ − Gib einem Charakter deiner Wahl in diesem Zug +1 ◆.', 'flavour': 'Du kannst die Zukunft verändern, wenn du weißt, nach was du suchst.', 'image': 'https://images.lorcania.com/cards/tfc/167_de_eye_of_the_fates-716.webp'}, 'FR': {'card_id': 208, 'language': 'FR', 'name': 'Œil des Morts', 'title': None, 'action': ""<mark>VOIR L'AVENIR</mark> ↷ − Choisissez un personnage, il gagne +1 ◆ pour le reste de ce tour."", 'flavour': ""Tu peux changer l'avenir, une fois que tu sais.. où regarder."", 'image': 'https://images.lorcania.com/cards/tfc/167_fr_eye_of_the_fates-716.webp'}}"
209,Fishbone Quill,,3,1,,,2,item,<mark>GO AHEAD AND SIGN</mark> ↷ − Put any card from your hand into your inkwell facedown.,"“If you want to cross the bridge, my sweet, you've got to pay the toll.” −Ursula",book,0,Tanisha Cherislin,2,EN,168,204,rare,https://images.lorcania.com/cards/tfc/168_en_fishbone_quill-716.webp,,21,1,0,2023-07-25T17:18:24.000000Z,2023-07-25T17:18:24.000000Z,['Item'],6.99,"{'id': 21, 'name': 'The Little Mermaid', 'slug': 'the-little-mermaid', 'brand': None, 'image': 'https://images.lorcania.com/site/franchises/The_Little_Mermaid.png'}","{'EN': {'card_id': 209, 'language': 'EN', 'name': 'Fishbone Quill', 'title': None, 'action': '<mark>GO AHEAD AND SIGN</mark> ↷ − Put any card from your hand into your inkwell facedown.', 'flavour': ""“If you want to cross the bridge, my sweet, you've got to pay the toll.” \n−Ursula"", 'image': 'https://images.lorcania.com/cards/tfc/168_en_fishbone_quill-716.webp'}, 'DE': {'card_id': 209, 'language': 'DE', 'name': 'Fischgrätenfeder', 'title': None, 'action': '<mark>UNTERSCHREIB DIE ROLLE, LOS!</mark> ↷ − Lege 1 beliebige Karte aus deiner Hand in deinen Tintenvorrat.', 'flavour': '„Mein Sonderangebot ist nur kurze Zeit zu haben.“ - Ursula', 'image': 'https://images.lorcania.com/cards/tfc/168_de_fishbone_quill-716.webp'}, 'FR': {'card_id': 209, 'language': 'FR', 'name': ""Plume en Forme d'arête"", 'title': None, 'action': ""<mark>SIGNE !</mark> ↷ − Placez une carte de votre main dans votre réserve d'encre, face cachée."", 'flavour': '""Si tu veux vraiment passer le pont, il faut payer l\'addition"" - Ursula', 'image': 'https://images.lorcania.com/cards/tfc/168_fr_fishbone_quill-716.webp'}}"
210,Donald Duck,Musketeer,4,1,2,5,6,glimmer,"<b>Bodyguard</b> <i>(This character may enter play exerted. An opposing character who challenges one of your characters must choose one with Bodyguard if able.)</i><br /><mark>STAY ALERT!</mark> During your turn, your Musketeer characters gain <b>Evasive.</b> <i>(They can challenge characters with Evasive.)</i>",,,1,Dav Augereau / Guykua Ruva,2,EN,177,204,uncommon,https://images.lorcania.com/cards/tfc/177_en_donald_duck-716.webp,,1,1,0,2023-07-25T17:21:33.000000Z,2023-07-25T17:21:33.000000Z,"['Dreamborn', 'Hero', 'Musketeer']",0.7,"{'id': 1, 'name': 'Micky Mouse and Friends', 'slug': 'micky-mouse-and-friends', 'brand': None, 'image': 'https://images.lorcania.com/site%2Ffranchises%2FMickey_Mouse_and_Friends.png'}","{'EN': {'card_id': 210, 'language': 'EN', 'name': 'Donald Duck', 'title': 'Musketeer', 'action': '<b>Bodyguard</b> <i>(This character may enter play exerted. An opposing character who challenges one of your characters must choose one with Bodyguard if able.)</i><br />\n<mark>STAY ALERT!</mark> During your turn, your Musketeer characters gain <b>Evasive.</b> <i>(They can challenge characters with Evasive.)</i>', 'flavour': None, 'image': 'https://images.lorcania.com/cards/tfc/177_en_donald_duck-716.webp'}, 'DE': {'card_id': 210, 'language': 'DE', 'name': 'Donald Duck', 'title': 'Musketier', 'action': '<b>Beschützen</b> <i>(Du darfst diesen Charakter erschöpft ausspielen. Gegnerische Charaktere müssen beim Herausfordern zuerst deine Charaktere mit Beschützen wählen, wenn möglich.)</i><br />\n<mark>BLEIB AUF DER HUT!</mark> Deine Musketiere erhalten in deinem Zug <b>Wendig.</b> <i>(Sie können Charaktere mit Wendig herausfordern.)</i>', 'flavour': None, 'image': 'https://images.lorcania.com/cards/tfc/177_de_donald_duck-716.webp'}, 'FR': {'card_id': 210, 'language': 'FR', 'name': 'Donald Duck', 'title': 'Mousquetaire', 'action': ""<b>Rempart</b> <i>(Ce personnage peut entrer en jeu épuisé. Lorsqu'il vous défie, un personnage adverse doit, si possible, choisir l'un de vos personnages avec Rempart)</i><br />\n<mark>RESTEZ SUR VOS GARDES!</mark> Durant votre tour, vos personnages Mousquetaires gagnent <b>Insaisissable.</b> <i>(Ils peuvent défier les personnages avec Insaisissable.)</i>"", 'flavour': None, 'image': 'https://images.lorcania.com/cards/tfc/177_fr_donald_duck-716.webp'}}"
211,Aladdin,Cornered Swordsman,2,1,2,1,6,glimmer,,"“Oh ho! So the street rat found a sword and a backbone!” −Razoul",pen,2,Randy Bishop,2,EN,171,204,common,https://images.lorcania.com/cards/tfc/171_en_aladdin-716.webp,,10,1,0,2023-07-25T17:23:49.000000Z,2023-07-25T17:23:49.000000Z,"['Hero', 'Storyborn']",0.25,"{'id': 10, 'name': 'Aladdin', 'slug': 'aladdin', 'brand': None, 'image': 'https://images.lorcania.com/site%2Ffranchises%2FAladdin.png'}","{'EN': {'card_id': 211, 'language': 'EN', 'name': 'Aladdin', 'title': 'Cornered Swordsman', 'action': None, 'flavour': '“Oh ho! So the street rat found a sword and a backbone!” \n−Razoul', 'image': 'https://images.lorcania.com/cards/tfc/171_en_aladdin-716.webp'}, 'DE': {'card_id': 211, 'language': 'DE', 'name': 'Aladdin', 'title': 'Schwertkämpfer in Bedrängnis', 'action': None, 'flavour': '„Oh ha! Der Straßenjunge hat also ein Schwert und ein Rückgrat!“ - Rasul', 'image': 'https://images.lorcania.com/cards/tfc/171_de_aladdin-716.webp'}, 'FR': {'card_id': 211, 'language': 'FR', 'name': 'Aladdin', 'title': 'Hors-la-loi acculé', 'action': None, 'flavour': '""Oh, oh ! On dirait que le vaurien a trouvé un sabre...et du courage !"" \n- Razoul', 'image': 'https://images.lorcania.com/cards/tfc/171_fr_aladdin-716.webp'}}"
212,Lilo,Galactic Hero,3,1,4,2,6,glimmer,,“Space. That's where aliens come from. And also tourists!”,pen,2,Jared Nickerl,2,EN,184,204,uncommon,https://images.lorcania.com/cards/tfc/184_en_lilo-716.webp,,2,1,0,2023-07-25T17:27:32.000000Z,2023-07-25T17:27:32.000000Z,"['Dreamborn', 'Hero']",0.36,"{'id': 2, 'name': 'Lilo and Stitch', 'slug': 'lilo-and-stitch', 'brand': None, 'image': 'https://images.lorcania.com/site%2Ffranchises%2FLilo_and_Stitch.png'}","{'EN': {'card_id': 212, 'language': 'EN', 'name': 'Lilo', 'title': 'Galactic Hero', 'action': None, 'flavour': ""“Space. That's where aliens come from. And also tourists!”"", 'image': 'https://images.lorcania.com/cards/tfc/184_en_lilo-716.webp'}, 'DE': {'card_id': 212, 'language': 'DE', 'name': 'Lilo', 'title': 'Galaktische Heldin', 'action': None, 'flavour': '„Der Weltraum. Von dort kommen die Aliens. Und auch die Touristen.“', 'image': 'https://images.lorcania.com/cards/tfc/184_de_lilo-716.webp'}, 'FR': {'card_id': 212, 'language': 'FR', 'name': 'Lilo', 'title': 'Héroïne galactique', 'action': None, 'flavour': '""L\'espace ! C\'est de là que viennent les extraterrestres...et aussi les touristes !""', 'image': 'https://images.lorcania.com/cards/tfc/184_fr_lilo-716.webp'}}"
213,Plasma Blaster,,3,0,,,6,item,"<mark>QUICK SHOT</mark> ↷, 2 ⬡ − Deal 1 damage to chosen character.","“You don't have to say 'pew pew' when you use it, but it doesn't hurt.” −Lilo, galactic hero",pen,0,Oleg Yurkov,2,EN,204,204,rare,https://images.lorcania.com/cards/tfc/204_en_plasma_blaster-716.webp,,2,1,0,2023-07-25T17:29:34.000000Z,2023-07-25T17:29:34.000000Z,['Item'],1.25,"{'id': 2, 'name': 'Lilo and Stitch', 'slug': 'lilo-and-stitch', 'brand': None, 'image': 'https://images.lorcania.com/site%2Ffranchises%2FLilo_and_Stitch.png'}","{'EN': {'card_id': 213, 'language': 'EN', 'name': 'Plasma Blaster', 'title': None, 'action': '<mark>QUICK SHOT</mark> ↷, 2 ⬡ − Deal 1 damage to chosen character.', 'flavour': ""“You don't have to say 'pew pew' when you use it, but it doesn't hurt.” \n−Lilo, galactic hero"", 'image': 'https://images.lorcania.com/cards/tfc/204_en_plasma_blaster-716.webp'}, 'DE': {'card_id': 213, 'language': 'DE', 'name': 'Plasma-Kanone', 'title': None, 'action': '<mark>SCHNELLFEUER</mark> ↷, 2 ⬡ − Füge einem Charakter deiner Wahl 1 Schaden zu.', 'flavour': '„Du musst nicht ‚pew pew‘sagen, wenn du sie benutzt, aber es hilft ungemein.“ - Lilo, Galaktische Heldin', 'image': 'https://images.lorcania.com/cards/tfc/204_de_plasma_blaster-716.webp'}, 'FR': {'card_id': 213, 'language': 'FR', 'name': 'Pistolet à Plasma', 'title': None, 'action': '<mark>TIR RAPIDE</mark> ↷, 2 ⬡ − Choisissez un personnage et infligez-lui 1 dommage.', 'flavour': '""Tu n\'as pas besoin de dire \'pew pew\' quand tu l\'utilises, mais ça ne fait pas de mal.""\n- Lilo, Héroïne galactique', 'image': 'https://images.lorcania.com/cards/tfc/204_fr_plasma_blaster-716.webp'}}"
214,Starkey,Hook's Henchman,5,1,5,4,6,glimmer,"<mark>AYE AYE, CAPTAIN</mark> While you have a Captain character in play, this character gets +1 ◆.","A pirate must be tough, loyal, and strong. “Smart” doesn't even make the list.",pen,1,Leonardo Giammichele,2,EN,191,204,uncommon,https://images.lorcania.com/cards/tfc/191_en_starkey-716.webp,,7,1,0,2023-07-25T17:32:05.000000Z,2023-07-25T17:32:05.000000Z,"['Ally', 'Pirate', 'Storyborn']",0.3,"{'id': 7, 'name': 'Peter Pan', 'slug': 'peter-pan', 'brand': None, 'image': 'https://images.lorcania.com/site%2Ffranchises%2FPeter_Pan.png'}","{'EN': {'card_id': 214, 'language': 'EN', 'name': 'Starkey', 'title': ""Hook's Henchman"", 'action': '<mark>AYE AYE, CAPTAIN</mark> While you have a Captain character in play, this character gets +1 ◆.', 'flavour': ""A pirate must be tough, loyal, and strong. “Smart” doesn't even make the list."", 'image': 'https://images.lorcania.com/cards/tfc/191_en_starkey-716.webp'}, 'DE': {'card_id': 214, 'language': 'DE', 'name': 'Starkey', 'title': 'Hooks Handlanger', 'action': ""<mark>AYE, AYE, KÄPT'N</mark> Dieser Charakter erhält +1 ◆, solange du mindestens eine Kapitänin oder einen Kapitän im Spiel hast"", 'flavour': 'Ein Pirat muss knallhart, loyal und stark sein. „Klug“ steht nicht einmal auf der Liste.', 'image': 'https://images.lorcania.com/cards/tfc/191_de_starkey-716.webp'}, 'FR': {'card_id': 214, 'language': 'FR', 'name': 'Monsieur Starkey', 'title': 'Acolyte de Crochet', 'action': '<mark>OUI, CAPITAINE</mark> Ce personnage a +1 ◆ tant que vous avez au moins un personnage Capitaine en jeu.', 'flavour': 'Un pirate doit être résistant, loyal et fort. ""Élégant."" ne fait pas partie de cette liste.', 'image': 'https://images.lorcania.com/cards/tfc/191_fr_starkey-716.webp'}}"
215,Te Ka,Heartless,6,1,5,5,6,glimmer,"<mark>SEEK THE HEART</mark> During your turn, whenever this character banishes another character in a challenge, you gain 2 lore.","Maui: “Ever defeat a lava monster?” Moana: “No. Have you?”",book,2,Andrew Trabbold,2,EN,192,204,legendary,https://images.lorcania.com/cards/tfc/192_en_te_ka-716.webp,,11,1,0,2023-07-25T17:34:33.000000Z,2023-07-25T17:34:33.000000Z,"['Deity', 'Dreamborn', 'Villain']",5.36,"{'id': 11, 'name': 'Moana', 'slug': 'moana', 'brand': None, 'image': 'https://images.lorcania.com/site%2Ffranchises%2FMoana.png'}","{'EN': {'card_id': 215, 'language': 'EN', 'name': 'Te Ka', 'title': 'Heartless', 'action': '<mark>SEEK THE HEART</mark> During your turn, whenever this character banishes another character in a challenge, you gain 2 lore.', 'flavour': 'Maui: “Ever defeat a lava monster?” \nMoana: “No. Have you?”', 'image': 'https://images.lorcania.com/cards/tfc/192_en_te_ka-716.webp'}, 'DE': {'card_id': 215, 'language': 'DE', 'name': 'Te Ka', 'title': 'Herzlos', 'action': '<mark>SUCHE DAS HERZ</mark>Jedes Mal, wenn dieser Charakter in deinem Zug durch eine Herausforderung einen anderen Charakter verbannt, sammelst du 2 Legenden.', 'flavour': 'Maui: „Schon mal ein Lavamonster besiegt?“\nVaiana: „Nein. Und du?“', 'image': 'https://images.lorcania.com/cards/tfc/192_de_te_ka-716.webp'}, 'FR': {'card_id': 215, 'language': 'FR', 'name': 'Te Ka', 'title': 'Sans coeur', 'action': '<mark>CHERCHE LE COEUR</mark> Lorsque ce personnage en bannit un autre via un défi durant votre tour, vous gagnez 2 éclats de Lore.', 'flavour': 'Maui : ""T\'as déjà vaincu un monstre de lave, toi?""\nVaiana : ""Non, et toi?""', 'image': 'https://images.lorcania.com/cards/tfc/192_fr_te_ka-716.webp'}}"
216,Hades,King of Olympus,8,0,6,7,4,glimmer,<b>Shift</b> 6 <i>(You may pay 6 ⬡ to play this on top of one of your characters named Hades.)</i><br /><mark>Sinister plot</mark> This character gets +1 ◆ for every other Villain character you have in play.,,,1,Juan Diego Leon,2,EN,205,204,enchanted,https://images.lorcania.com/cards/tfc/205_en_hades-716.webp,,9,1,0,2023-08-03T18:46:25.000000Z,2023-08-03T18:46:25.000000Z,"['Floodborn', 'Villain', 'King', 'Deity']",0,"{'id': 9, 'name': 'Hercules', 'slug': 'hercules', 'brand': None, 'image': 'https://images.lorcania.com/site%2Ffranchises%2FHercules.png'}","{'EN': {'card_id': 216, 'language': 'EN', 'name': 'Hades', 'title': 'King of Olympus', 'action': '<b>Shift</b> 6 <i>(You may pay 6 ⬡ to play this on top of one of your characters named Hades.)</i><br /><mark>Sinister plot</mark> This character gets +1 ◆ for every other Villain character you have in play.', 'flavour': None, 'image': 'https://images.lorcania.com/cards/tfc/205_en_hades-716.webp'}, 'DE': {'card_id': 216, 'language': 'DE', 'name': 'Hades', 'title': 'König des Olymps', 'action': '<b>Gestaltwandel</b> 6 (<i>Du kannst 6 ⬡ zahlen, um diesen Charakter auf einen deiner Hades-Charaktere auszuspielen.</i>)<br /><mark>FINSTERE VERSCHWÖRUNG</mark> Dieser Charakter erhält +1 ◆ für jede weitere Schurkin und jeden weiteren Schurken, die du im Spiel hast.', 'flavour': None, 'image': None}, 'FR': {'card_id': 216, 'language': 'FR', 'name': 'Hadès', 'title': ""Roi de l'Olympe"", 'action': ""<b>Alter</b> 6 (<i>Vous pouvez payer 6 ⬡ pour jouer ce personnage sur l'un de vos personnages Hadès.</i>)<br /><mark>SINISTRE COMPLOT</mark> Ce personnage a + 1 ◆ pour chaque autre personnage Méchant que vous avez en jeu."", 'flavour': '""Oh, mais j\'y pense, il va me falloir de nouvelles cartes de visite.""', 'image': None}}"
217,Stitch,Carefree Surfer,7,1,4,8,4,glimmer,"<mark>OHANA</mark> When you play this character, if you have 2 or more other characters in play, you may draw 2 cards.",,,2,Milica Celikovic,2,EN,206,204,enchanted,https://images.lorcania.com/cards/tfc/206_en_stitch-716.webp,,2,1,0,2023-08-03T18:55:18.000000Z,2023-08-03T18:55:18.000000Z,"['Alien', 'Dreamborn', 'Hero']",0,"{'id': 2, 'name': 'Lilo and Stitch', 'slug': 'lilo-and-stitch', 'brand': None, 'image': 'https://images.lorcania.com/site%2Ffranchises%2FLilo_and_Stitch.png'}","{'EN': {'card_id': 217, 'language': 'EN', 'name': 'Stitch', 'title': 'Carefree Surfer', 'action': '<mark>OHANA</mark> When you play this character, if you have 2 or more other characters in play, you may draw 2 cards.', 'flavour': None, 'image': 'https://images.lorcania.com/cards/tfc/206_en_stitch-716.webp'}, 'DE': {'card_id': 217, 'language': 'DE', 'name': 'Stitch', 'title': 'Sorgloser Surfer', 'action': '<mark>OHANA</mark> Wenn du diesen Charakter ausspielst und mindestens 2 weitere Charaktere im Spiel hast, darfst du 2 Karten ziehen.', 'flavour': None, 'image': None}, 'FR': {'card_id': 217, 'language': 'FR', 'name': 'Stitch', 'title': 'Surfeur insouciant', 'action': '<mark>OHANA</mark>Si vous avez au moins 2 autres personnages en jeu lorsque vous jouez ce personnage, vous pouvez piocher 2 cartes.', 'flavour': '""Alors, comme ça, tu viens de l\'espace ? Il paraît qu\'il y a de belles vagues là-haut."" - David', 'image': None}}"
218,Elsa,Spirit of Winter,8,0,4,6,5,glimmer,"<b>Shift</b> 6 <i>(You may pay 6 ⬡ to play this on top of one of your characters named Elsa.)</i><br /><mark>DEEP FREEZE</mark> When you play this character, exert up to 2 chosen characters. They can't ready at the start of their next turn.",,,3,Matthew Robert Davies,2,EN,207,204,enchanted,https://images.lorcania.com/cards/tfc/207_en_elsa-716.webp,,3,1,0,2023-08-03T18:57:10.000000Z,2023-08-03T18:57:10.000000Z,"['Hero', 'Floodborn', 'Queen', 'Sorcerer']",0,"{'id': 3, 'name': 'Frozen', 'slug': 'frozen', 'brand': None, 'image': 'https://images.lorcania.com/site%2Ffranchises%2FFrozen.png'}","{'EN': {'card_id': 218, 'language': 'EN', 'name': 'Elsa', 'title': 'Spirit of Winter', 'action': ""<b>Shift</b> 6 <i>(You may pay 6 ⬡ to play this on top of one of your characters named Elsa.)</i><br />\n<mark>DEEP FREEZE</mark> When you play this character, exert up to 2 chosen characters. They can't ready at the start of their next turn."", 'flavour': None, 'image': 'https://images.lorcania.com/cards/tfc/207_en_elsa-716.webp'}, 'DE': {'card_id': 218, 'language': 'DE', 'name': 'Elsa', 'title': 'Magie des Winters', 'action': '<b>Shift</b> 6 <i>(Du kannst 6 ⬡ bezahlen, um diesen Charakter auf einen deiner anderen Ela-Charaktere zu spielen.)</i><br />\n<mark>EISESKÄLTE</mark> Wenn du diesen Charakter ausspielst, erschöpfe bis zu 2 Charaktere deiner Wahl. Sie werden zu beginn ihres nächsten Zug nicht wieder bereit gemacht.', 'flavour': None, 'image': None}, 'FR': {'card_id': 218, 'language': 'FR', 'name': None, 'title': None, 'action': None, 'flavour': None, 'image': None}}"
219,Mickey Mouse,Wayward Sorcerer,4,1,3,4,5,glimmer,"<mark>ANIMATE BROOM</mark> You pay 1 ⬡ less to play Broom characters.<br /><mark>CEASELESS WORKER</mark> Whenever one of your Broom characters is banished in a challenge, you may return that card to your hand.",,,2,Cam Kendell,2,EN,208,204,enchanted,https://images.lorcania.com/cards/tfc/208_en_mickey_mouse-716.webp,,1,1,0,2023-08-03T18:58:44.000000Z,2023-08-03T18:58:44.000000Z,"['Dreamborn', 'Sorcerer']",0,"{'id': 1, 'name': 'Micky Mouse and Friends', 'slug': 'micky-mouse-and-friends', 'brand': None, 'image': 'https://images.lorcania.com/site%2Ffranchises%2FMickey_Mouse_and_Friends.png'}","{'EN': {'card_id': 219, 'language': 'EN', 'name': 'Mickey Mouse', 'title': 'Wayward Sorcerer', 'action': '<mark>ANIMATE BROOM</mark> You pay 1 ⬡ less to play Broom characters.<br />\u2028<mark>CEASELESS WORKER</mark> Whenever one of your Broom characters is banished in a challenge, you may return that card to your hand.', 'flavour': None, 'image': 'https://images.lorcania.com/cards/tfc/208_en_mickey_mouse-716.webp'}, 'DE': {'card_id': 219, 'language': 'DE', 'name': 'Micky Maus', 'title': 'Eigenwilliger Zauberer', 'action': '<mark>LEBENDIGER BESEN</mark> Du zahlst 1 ⬡ weniger, um Besen auszuspielen.<br />\u2028<mark>UNERMÜDLICHE ARBEITER</mark> Jedes Mal, wenn einer deiner Besen durch eine Herausforderung verbannt wird, darfst du jene Karte zurück auf deine Hand nehmen.', 'flavour': 'Immer für eine saubere Sache zu haben.', 'image': None}, 'FR': {'card_id': 219, 'language': 'FR', 'name': 'Mickey Mouse', 'title': 'Sorcier renégat', 'action': ""<mark>ANIMER LES BALAIS</mark> Les personnages Balai vous coûtent 1 ⬡ de moins à jouer.<br />\u2028<mark>TRAVAILLEUR INFATIGABLE</mark> Si l'un de vos personnages Balai est banni via un défi, vous pouvez le reprendre en main."", 'flavour': 'Les problèmes ? Il les balaie !', 'image': None}}"
