id,name,title,cost,inkwell,attack,defence,color,type,action,flavour,separator,stars,illustrator,card_set_id,language,number,pack,rarity,image,blurhash,franchise_id,final,spoiler,created_at,updated_at,traits,prices,franchise,languages
1,Mickey Mouse,Brave Little Tailor,8,1,5,5,1,glimmer,<b>Evasive</b> (<i>Only characters with Evasive can challenge this character.</i>),"When defeat looms and victory hangs by a thread, a hero bolts to the rescue, patching things up through shear determination.",pen,4,Nicholas Kole,1,EN,1,P1,promo,https://images.lorcania.com/cards/d23/1_en_mickey-716.webp,LGKAN9Vt5kxDA0M|xrs:ugELnPj[,1,1,0,2022-09-22T12:35:18.000000Z,2022-09-22T12:35:18.000000Z,"['Hero', 'Dreamborn']",2499.01,"{'id': 1, 'name': 'Micky Mouse and Friends', 'slug': 'micky-mouse-and-friends', 'brand': None, 'image': 'https://images.lorcania.com/site%2Ffranchises%2FMickey_Mouse_and_Friends.png'}","{'EN': {'card_id': 1, 'language': 'EN', 'name': 'Mickey Mouse', 'title': 'Brave Little Tailor', 'action': '<b>Evasive</b> (<i>Only characters with Evasive can challenge this character.</i>)', 'flavour': 'When defeat looms and victory hangs by a thread, a hero bolts to the rescue, patching things up through shear determination.', 'image': 'https://images.lorcania.com/cards/d23/1_en_mickey-716.webp'}}"
2,Stitch,Rock Star,6,1,3,5,4,glimmer,"<b>Shift</b> 4 (<i>You may pay 4 * to play this on top of one of your Stitch characters.</i>)<br><mark>Adoring Fans</mark> Whenever you play a character with cost 2 or less, you may exert it to draw a card.",The best part about a beachside concert is that there's always room for one more.,pen,3,Simangaliso Sibaya,1,EN,2,P1,promo,https://images.lorcania.com/cards/d23/2_en_stitch-716.webp,L3Jjbh5800Vr0FOWVBt600S${]^k,2,1,0,2022-09-22T12:35:18.000000Z,2022-09-22T12:35:18.000000Z,"['Hero', 'Floodborn', 'Alien']",0,"{'id': 2, 'name': 'Lilo and Stitch', 'slug': 'lilo-and-stitch', 'brand': None, 'image': 'https://images.lorcania.com/site%2Ffranchises%2FLilo_and_Stitch.png'}","{'EN': {'card_id': 2, 'language': 'EN', 'name': 'Stitch', 'title': 'Rock Star', 'action': '<b>Shift</b> 4 (<i>You may pay 4 * to play this on top of one of your Stitch characters.</i>)<br><mark>Adoring Fans</mark> Whenever you play a character with cost 2 or less, you may exert it to draw a card.', 'flavour': ""The best part about a beachside concert is that there's always room for one more."", 'image': 'https://images.lorcania.com/cards/d23/2_en_stitch-716.webp'}}"
3,Elsa,Snow Queen,3,1,2,3,5,glimmer,<mark>Freeze</mark> ↷ - Exert chosen opposing character.,"Recreated by magical ink, Elsa found herself in an unfamiliar new world. Fortunately, ice works the same way everywhere.",pen,1,Nicholas Kole,1,EN,3,P1,promo,https://images.lorcania.com/cards/d23/3_en_elsa-716.webp,LKHeFKi_4.Wo0uxBR#WB$@n#n-e-,3,1,0,2022-09-22T12:35:18.000000Z,2022-09-22T12:35:18.000000Z,"['Hero', 'Dreamborn', 'Queen', 'Sorcerer']",0,"{'id': 3, 'name': 'Frozen', 'slug': 'frozen', 'brand': None, 'image': 'https://images.lorcania.com/site%2Ffranchises%2FFrozen.png'}","{'EN': {'card_id': 3, 'language': 'EN', 'name': 'Elsa', 'title': 'Snow Queen', 'action': '<mark>Freeze</mark> ↷ - Exert chosen opposing character.', 'flavour': 'Recreated by magical ink, Elsa found herself in an unfamiliar new world. Fortunately, ice works the same way everywhere.', 'image': 'https://images.lorcania.com/cards/d23/3_en_elsa-716.webp'}}"
4,Cruella De Vil,Miserable As Usual,2,1,1,3,3,glimmer,"<mark>You'll Be Sorry</mark> When this character is challenged and banished, you may return chosen character to their player's hand.","When she stops by, misery is company.",pen,1,Nicholas Kole,1,EN,4,P1,promo,https://images.lorcania.com/cards/d23/4_en_cruella-716.webp,LFH_o5Iq4;bE07bEX4of_kR*K3%1,4,1,0,2022-09-22T12:35:18.000000Z,2022-09-22T12:35:18.000000Z,"['Storyborn', 'Villain']",0,"{'id': 4, 'name': '101 Dalmatians', 'slug': '101-dalmatians', 'brand': None, 'image': 'https://images.lorcania.com/site%2Ffranchises%2F101_Dalmatiner.png'}","{'EN': {'card_id': 4, 'language': 'EN', 'name': 'Cruella De Vil', 'title': 'Miserable As Usual', 'action': ""<mark>You'll Be Sorry</mark> When this character is challenged and banished, you may return chosen character to their player's hand."", 'flavour': 'When she stops by, misery is company.', 'image': 'https://images.lorcania.com/cards/d23/4_en_cruella-716.webp'}}"
5,Maleficent,Monstrous Dragon,9,1,7,5,1,glimmer,"<mark>Dragon Fire</mark> When you play this character, you may banish chosen opposing character.","The ninth Rule of Villainy: When all else fails, turn into a dragon.",pen,2,Luis Huerta,1,EN,5,P1,promo,https://images.lorcania.com/cards/d23/5_en_maleficent-716.webp,L6J~u]je0fE%01-o%ZOr4GnjNH-m,5,1,0,2022-09-22T12:35:18.000000Z,2022-09-22T12:35:18.000000Z,"['Storyborn', 'Villain', 'Dragon']",0,"{'id': 5, 'name': 'Sleeping Beauty', 'slug': 'sleeping-beauty', 'brand': None, 'image': 'https://images.lorcania.com/site%2Ffranchises%2FSleeping_Beauty.png'}","{'EN': {'card_id': 5, 'language': 'EN', 'name': 'Maleficent', 'title': 'Monstrous Dragon', 'action': '<mark>Dragon Fire</mark> When you play this character, you may banish chosen opposing character.', 'flavour': 'The ninth Rule of Villainy: When all else fails, turn into a dragon.', 'image': 'https://images.lorcania.com/cards/d23/5_en_maleficent-716.webp'}, 'DE': {'card_id': 5, 'language': 'DE', 'name': None, 'title': None, 'action': None, 'flavour': None, 'image': None}, 'FR': {'card_id': 5, 'language': 'FR', 'name': None, 'title': None, 'action': None, 'flavour': None, 'image': None}}"
6,Robin Hood,Unrivaled Archer,6,1,4,4,2,glimmer,"<mark>Feed The Poor</mark> When you play this character, if an opponent has more cards in their hand than you, draw a card.<br><mark>Good Shot</mark> During your turn, this character has <b>Evasive</b>. (<i>They can challenge characters with Evasive.</i>)","""We never rob. We just sort of borrow a bit from those who can afford it.""",pen,2,John Loren,1,EN,6,P1,promo,https://images.lorcania.com/cards/d23/6_en_robin-716.webp,L9GlLpHD02iI02yq$jn3Uuv~t8t7,6,1,0,2022-09-22T12:35:18.000000Z,2022-09-22T12:35:18.000000Z,"['Hero', 'Storyborn']",0,"{'id': 6, 'name': 'Robin Hood', 'slug': 'robin-hood', 'brand': None, 'image': 'https://images.lorcania.com/site%2Ffranchises%2FRobin_Hood.png'}","{'EN': {'card_id': 6, 'language': 'EN', 'name': 'Robin Hood', 'title': 'Unrivaled Archer', 'action': '<mark>Feed The Poor</mark> When you play this character, if an opponent has more cards in their hand than you, draw a card.<br><mark>Good Shot</mark> During your turn, this character has <b>Evasive</b>. (<i>They can challenge characters with Evasive.</i>)', 'flavour': '""We never rob. We just sort of borrow a bit from those who can afford it.""', 'image': 'https://images.lorcania.com/cards/d23/6_en_robin-716.webp'}}"
7,Captain Hook,Forceful Duelist,1,1,1,2,6,glimmer,"<b>Challenger</b> +2 (<i>When challenging, this character get +2 ※.</i>)",He loves to make light of a foe's predicament.,pen,1,Marcel Berg,1,EN,7,P1,promo,https://images.lorcania.com/cards/d23/7_en_hook-716.webp,L7H24X^*029a05?GXgIU{@RQots*,7,1,0,2022-09-22T12:35:18.000000Z,2022-09-22T12:35:18.000000Z,"['Dreamborn', 'Villain', 'Pirate', 'Captain']",0,"{'id': 7, 'name': 'Peter Pan', 'slug': 'peter-pan', 'brand': None, 'image': 'https://images.lorcania.com/site%2Ffranchises%2FPeter_Pan.png'}","{'EN': {'card_id': 7, 'language': 'EN', 'name': 'Captain Hook', 'title': 'Forceful Duelist', 'action': '<b>Challenger</b> +2 (<i>When challenging, this character get +2 ※.</i>)', 'flavour': ""He loves to make light of a foe's predicament."", 'image': 'https://images.lorcania.com/cards/d23/7_en_hook-716.webp'}}"
8,Dragon Fire,,5,0,,,1,action,Banish chosen character.,Rare is the hero who can withstand a dragon's wrath.,pen,0,Luis Huerta,2,EN,130,204,uncommon,https://images.lorcania.com/cards/tfc/130_en_dragon_fire-716.webp,"L3KTF%0403,A00Q#xu,K0G.Y??u=",5,1,0,2022-12-20T18:21:54.000000Z,2022-12-20T18:21:54.000000Z,['Action'],0.75,"{'id': 5, 'name': 'Sleeping Beauty', 'slug': 'sleeping-beauty', 'brand': None, 'image': 'https://images.lorcania.com/site%2Ffranchises%2FSleeping_Beauty.png'}","{'EN': {'card_id': 8, 'language': 'EN', 'name': 'Dragon Fire', 'title': None, 'action': 'Banish chosen character.', 'flavour': ""Rare is the hero who can withstand a dragon's wrath."", 'image': 'https://images.lorcania.com/cards/tfc/130_en_dragon_fire-716.webp'}, 'DE': {'card_id': 8, 'language': 'DE', 'name': 'Drachenfeuer', 'title': None, 'action': 'Verbanne einen Charakter deiner Wahl.', 'flavour': 'Es gibt kaum Helden, die dem Zorn eines Drachen trotzen können.', 'image': 'https://images.lorcania.com/cards/tfc/130_de_dragon_fire-716.webp'}, 'FR': {'card_id': 8, 'language': 'FR', 'name': 'Feu Du Dragon', 'title': None, 'action': 'Choisissez un personnage et bannissez-le.', 'flavour': ""Rares sont les Héros capables de résister à la colère d'un dragon."", 'image': 'https://images.lorcania.com/cards/tfc/130_fr_dragon_fire-716.webp'}}"
9,Olaf,Friendly Snowman,1,1,1,3,5,glimmer,,"""I'm Olaf and I like warm hugs!""",book,1,Giulia Riva,2,EN,52,204,uncommon,https://images.lorcania.com/cards/tfc/52_en_olaf-716.webp,LAMPg=WB00FH*cR~D~NGF9S|S%wI,3,1,0,2022-12-26T18:16:40.000000Z,2022-12-26T18:16:40.000000Z,"['Storyborn', 'Ally']",0.25,"{'id': 3, 'name': 'Frozen', 'slug': 'frozen', 'brand': None, 'image': 'https://images.lorcania.com/site%2Ffranchises%2FFrozen.png'}","{'EN': {'card_id': 9, 'language': 'EN', 'name': 'Olaf', 'title': 'Friendly Snowman', 'action': None, 'flavour': '""I\'m Olaf and I like warm hugs!""', 'image': 'https://images.lorcania.com/cards/tfc/52_en_olaf-716.webp'}, 'DE': {'card_id': 9, 'language': 'DE', 'name': 'Olaf', 'title': 'Freundlicher Schneemann', 'action': None, 'flavour': '„Ich bin Olaf und ich liebe Umarmungen.“', 'image': 'https://images.lorcania.com/cards/tfc/52_de_olaf-716.webp'}, 'FR': {'card_id': 9, 'language': 'FR', 'name': 'Olaf', 'title': 'Bonhomme de neige amical', 'action': None, 'flavour': '""Salut, je suis Olaf et j\'aime les câlins chaleureux!""', 'image': 'https://images.lorcania.com/cards/tfc/61_fr_olaf-716.webp'}}"
10,Jumba Jookiba,Renegade Scientist,5,1,4,5,3,glimmer,,"""Created something? Ha! But that would be irresponsible and unethical. I would never, ever . . . make more than one.""",book,2,Milica Celikovic,2,EN,83,204,uncommon,https://images.lorcania.com/cards/tfc/83_en_jumba_jookiba-716.webp,L6G[_l9K02?800%LR7%KqL%F?;N3,2,1,0,2023-01-13T17:57:29.000000Z,2023-01-13T17:57:29.000000Z,"['Dreamborn', 'Alien', 'Inventor']",0.34,"{'id': 2, 'name': 'Lilo and Stitch', 'slug': 'lilo-and-stitch', 'brand': None, 'image': 'https://images.lorcania.com/site%2Ffranchises%2FLilo_and_Stitch.png'}","{'EN': {'card_id': 10, 'language': 'EN', 'name': 'Jumba Jookiba', 'title': 'Renegade Scientist', 'action': None, 'flavour': '""Created something? Ha! But that would be irresponsible and unethical. I would never, ever . . . make more than one.""', 'image': 'https://images.lorcania.com/cards/tfc/83_en_jumba_jookiba-716.webp'}, 'DE': {'card_id': 10, 'language': 'DE', 'name': 'Jamba Jookiba', 'title': 'Abtrünniger Wissenschaftler', 'action': None, 'flavour': '„Etwas geschaffen? Ha, das wäre nciht verantwortlich und gegen jede Ethik! Ich würde niemals, nie ... produzieren mehr als eins?“', 'image': 'https://images.lorcania.com/cards/tfc/83_de_jumba_jookiba-716.webp'}, 'FR': {'card_id': 10, 'language': 'FR', 'name': 'Jumba Jookiba', 'title': 'Scientifique renégat', 'action': None, 'flavour': '""Créer un être, moi ? Ha ! Mais ce serait totalement irresponsable et contraire à l\'éthique. Je ne pourrais jamais, jamais...enfin si...peut-être...pour essayer.""', 'image': 'https://images.lorcania.com/cards/tfc/83_fr_jumba_jookiba-716.webp'}}"
11,Pascal,Rapunzel's Companion,1,1,1,1,5,glimmer,"<mark>CAMOUFLAGE</mark> While you have another character in play, this character gains <b>Evasive</b>. <i>(Only characters with Evasive can challenge them.)</i>","A true friend is always there for you, whether you can see them or not.",pen,1,Brian Weisz,2,EN,53,204,uncommon,https://images.lorcania.com/cards/tfc/53_en_pascal-716.webp,,13,1,0,2023-01-17T14:58:34.000000Z,2023-01-17T14:58:34.000000Z,"['Storyborn', 'Ally']",0.7,"{'id': 13, 'name': 'Tangled', 'slug': 'tangled', 'brand': None, 'image': 'https://images.lorcania.com/site%2Ffranchises%2FTangled.png'}","{'EN': {'card_id': 11, 'language': 'EN', 'name': 'Pascal', 'title': ""Rapunzel's Companion"", 'action': '<mark>CAMOUFLAGE</mark> While you have another character\rin play, this character gains <b>Evasive</b>. <i>(Only characters\rwith Evasive can challenge them.)</i>', 'flavour': 'A true friend is always there for you, whether you can\rsee them or not.', 'image': 'https://images.lorcania.com/cards/tfc/53_en_pascal-716.webp'}, 'DE': {'card_id': 11, 'language': 'DE', 'name': 'Pascal', 'title': 'Rapunzels Begleiter', 'action': '<mark>TARNUNG</mark> Dieser Charakter erhält<b>Wendig</b>, solange du mindestens einen weiteren Charakter im Spiel hast. <i>(Nur Charaktere mit Wendig können ihn herausfordern.)</i>', 'flavour': 'Ein wahrer Freund ist immer für dich da, ob du ihn sehen kannst, oder nicht.', 'image': 'https://images.lorcania.com/cards/tfc/53_de_pascal-716.webp'}, 'FR': {'card_id': 11, 'language': 'FR', 'name': 'Pascal', 'title': 'Compagnon de Raiponce', 'action': '<mark>CAMOUFLAGE</mark>Tant que vous avez un autre personnage en jeu, ce personnage gagne\n<b>Insaisissable.</b><i>(Seuls les personnages avec\nInsaisissable peuvent le défier.)</i>', 'flavour': 'Un véritable ami est toujours là pour toi, que tu le\nvoies ou non.', 'image': 'https://images.lorcania.com/cards/tfc/53_fr_pascal-716.webp'}}"
12,Aurora,Dreaming Guardian,5,1,3,5,2,glimmer,<b>Shift</b> 3 (<i>You may pay 3 ⬡ to play this on top of one of your characters named Aurora.</i>)<br><mark>Protective Embrace</mark> Your other characters gain <b>Ward</b>. <i>(Opponents can't choose them except to challenge.)</i>,"As the princess slumbered, her power awoke.",pen,2,Nicholas Kole,2,EN,139,204,super_rare,https://images.lorcania.com/cards/tfc/139_en_aurora-716.webp,L6H.E2+$00IT0C^iEINb_OR#Gco~,5,1,0,2023-01-17T14:59:37.000000Z,2023-01-17T14:59:37.000000Z,"['Hero', 'Floodborn', 'Princess']",4.73,"{'id': 5, 'name': 'Sleeping Beauty', 'slug': 'sleeping-beauty', 'brand': None, 'image': 'https://images.lorcania.com/site%2Ffranchises%2FSleeping_Beauty.png'}","{'EN': {'card_id': 12, 'language': 'EN', 'name': 'Aurora', 'title': 'Dreaming Guardian', 'action': ""<b>Shift</b> 3 (<i>You may pay 3 ⬡ to play this on top of one of your characters named Aurora.</i>)<br><mark>Protective Embrace</mark> Your other characters gain <b>Ward</b>. <i>(Opponents can't choose them except to challenge.)</i>"", 'flavour': 'As the princess slumbered, her power awoke.', 'image': 'https://images.lorcania.com/cards/tfc/139_en_aurora-716.webp'}, 'DE': {'card_id': 12, 'language': 'DE', 'name': 'Aurora', 'title': 'Wächterin der Träume', 'action': '<b>Gestaltwandel</b> 3 (<i>Du kannst 3 ⬡ zahlen, um diesen Charakter auf einen deiner Aurora-Charaktere auszuspielen.)</i>)<br><mark>SCHÜTZENDE UMARMUNG</mark> Deine anderen Charaktere erhalten <b>Behütet</b>. <i>(Gegnerische Karten können diese Charaktere nicht auswählen, außer um sie herauszufordern.)</i>', 'flavour': 'Während die Prinzessin schlummerte, erwachte ihre Macht.', 'image': 'https://images.lorcania.com/cards/tfc/139_de_aurora-716.webp'}, 'FR': {'card_id': 12, 'language': 'FR', 'name': 'Aurore', 'title': 'Gardienne Rêveuse', 'action': ""<b>Alter</b> 3 (<i>Vous pouvez payer 3 ⬡ pour jouer ce personnage sur un autre personnage Aurore.</i>)<br><mark>ÉTREINTE PROTECTRICE</mark> Vos autres personnages gagnent <b>Hors d'atteinte</b>. <i>(Ils ne peuvent pas être choisis par vos adversaires, hormis pour un défi.)</i>"", 'flavour': ""Et tandis que la princesse dormait profondément,\nsa puissance s'éveilla."", 'image': 'https://images.lorcania.com/cards/tfc/139_fr_aurora-716.webp'}}"
13,Maleficent,Sinister Visitor,4,1,3,4,2,glimmer,,"„The princess shall indeed grow in grace and beauty, beloved by all who know her. But before the sun sets on her sixteenth birthday, she shall prick her finger on the spindle of a spinning wheel...“",book,2,Nicholas Kole,2,EN,150,204,common,https://images.lorcania.com/cards/tfc/150_en_maleficent-716.webp,"LEF6qYX:DOZf0IyDvyn2|,nga0oz",5,1,0,2023-01-17T15:03:16.000000Z,2023-01-17T15:03:16.000000Z,"['Storyborn', 'Villain', 'Sorcerer']",0.2,"{'id': 5, 'name': 'Sleeping Beauty', 'slug': 'sleeping-beauty', 'brand': None, 'image': 'https://images.lorcania.com/site%2Ffranchises%2FSleeping_Beauty.png'}","{'EN': {'card_id': 13, 'language': 'EN', 'name': 'Maleficent', 'title': 'Sinister Visitor', 'action': None, 'flavour': '„The princess shall indeed grow in grace and beauty, beloved by all who know her. But before the sun sets on her sixteenth birthday, she shall prick her finger on the spindle of a spinning wheel...“', 'image': 'https://images.lorcania.com/cards/tfc/150_en_maleficent-716.webp'}, 'DE': {'card_id': 13, 'language': 'DE', 'name': 'Malefiz', 'title': 'Böser Besuch', 'action': None, 'flavour': '„Die Prizessin soll strahlend und schön wie eine Rose erblühen. Und von einem jeden geliebt werden, der ihr begegnet. Jedoch, bevor sie ihren 16. Geburtstag untergeht, soll sie sich mit der Spindel eines Spinnrades in den Finger stechen ...“', 'image': 'https://images.lorcania.com/cards/tfc/150_de_maleficent-716.webp'}, 'FR': {'card_id': 13, 'language': 'FR', 'name': 'Maléfique', 'title': 'Sinistre visiteuse', 'action': None, 'flavour': '""La princesse, en grandissant, aura la grâce et la beauté. Chacun l\'aimera et lui sera dévoué. Mais ma volonté est telle qu\'avant l\'aube de ses seize ans, elle se piquera le doigt à la pointe d\'une quenouille.""', 'image': 'https://images.lorcania.com/cards/tfc/150_fr_maleficent-716.webp'}}"
14,Moana,Of Motunui,5,1,1,6,4,glimmer,"<mark>WE CAN FIX IT</mark> Whenever this character quests, you may ready your other Princess characters. They can‘t quest for the rest of this turn.","„I am Moana of Motunui. You will board my boat, sail across the sea, and restore the heart of Te Fiti.“",book,3,Nicholas Kole,2,EN,14,204,rare,https://images.lorcania.com/cards/tfc/14_en_moana-716.webp,L5LfgJ{I2^0g00xZ.POr1m0jmm~A,11,1,0,2023-01-17T15:03:16.000000Z,2023-01-17T15:03:16.000000Z,"['Hero', 'Storyborn', 'Princess']",2.17,"{'id': 11, 'name': 'Moana', 'slug': 'moana', 'brand': None, 'image': 'https://images.lorcania.com/site%2Ffranchises%2FMoana.png'}","{'EN': {'card_id': 14, 'language': 'EN', 'name': 'Moana', 'title': 'Of Motunui', 'action': '<mark>WE CAN FIX IT</mark> Whenever this character quests, you may ready your other Princess characters. They can‘t quest for the rest of this turn.', 'flavour': '„I am Moana of Motunui. You will board my boat, sail\racross the sea, and restore the heart of Te Fiti.“', 'image': 'https://images.lorcania.com/cards/tfc/14_en_moana-716.webp'}, 'DE': {'card_id': 14, 'language': 'DE', 'name': 'Vaiana', 'title': 'Von Motunui', 'action': '<mark>WIR KRIEGEN DAS HIN</mark> Jedes Mal, wenn dieser Charakter erkundet, darfst du deine anderen Prinzessinnen bereit machen. Sie können in diesem Zug nicht mehr erkunden.', 'flavour': '„Ich bin Vaiana von Motunui. Du kommst jetzt auf mein Boot, segelst über das Meer und bringst das Herz nach Te Fiti zurück.“', 'image': 'https://images.lorcania.com/cards/tfc/14_de_moana-716.webp'}, 'FR': {'card_id': 14, 'language': 'FR', 'name': 'Vaiana', 'title': 'de Motunui', 'action': ""<mark>NOUS ALLONS LE RÉPARER</mark> Lorsque ce personnage est envoyé à l'aventure, vous pouvez redresser vos autres personnages Princesse. Elles ne peuvent pas être envoyées à l'aventure pour le reste de ce tour."", 'flavour': '""Je suís Vaiana de Motunui. Tu vas monter sur mon bateau, traverser la mer et restituer le cœur de Te Fiti.""', 'image': 'https://images.lorcania.com/cards/tfc/14_fr_moana-716.webp'}}"
15,Simba,Returned King,7,1,4,6,6,glimmer,"<b>Challenger</b> +4 (While challenging, this character gets +4 ※.)<br /><mark>POUNCE</mark> During your turn, this character gains  <b>Evasive</b>. <i>(They can challenge characters with Evasive.)</i>",„I‘ll do whatever it takes to save my kingdom.“,pen,2,Nicholas Kole,2,EN,189,204,rare,https://images.lorcania.com/cards/tfc/189_en_simba-716.webp,L8L|DT-:8I00vu.7%}4T1ZNHH?iH,12,1,0,2023-01-17T15:03:16.000000Z,2023-01-17T15:03:16.000000Z,"['Hero', 'Storyborn', 'King']",1.49,"{'id': 12, 'name': 'The Lion King', 'slug': 'the-lion-king', 'brand': None, 'image': 'https://images.lorcania.com/site%2Ffranchises%2FLion_King.png'}","{'EN': {'card_id': 15, 'language': 'EN', 'name': 'Simba', 'title': 'Returned King', 'action': '<b>Challenger</b> +4 (While challenging, this character gets\n+4 ※.)<br /><mark>POUNCE</mark> During your turn, this character gains \n<b>Evasive</b>. <i>(They can challenge characters with Evasive.)</i>', 'flavour': '„I‘ll do whatever it takes to save my kingdom.“', 'image': 'https://images.lorcania.com/cards/tfc/189_en_simba-716.webp'}, 'DE': {'card_id': 15, 'language': 'DE', 'name': 'Simba', 'title': 'Zurückgekehrter König', 'action': '<b>Herausfordern</b> +4 (Während dieser Charakter herausfordert, erhält er +4 ※.)<br /><mark>KATZENSPRUNG</mark> In deinem Zug erhält dieser Charakter <b>Wendig</b>. <i>(Er kann Charaktere mit Wendig herausfordern.)</i>', 'flavour': '„Ich werde alles tun, um mein Königreich zu retten.“', 'image': 'https://images.lorcania.com/cards/tfc/189_de_simba-716.webp'}, 'FR': {'card_id': 15, 'language': 'FR', 'name': 'Simba', 'title': 'Roi de retour', 'action': ""<b>Offensif</b> +4 (Lorsqu'il défie, ce personnage gagne +4 ※.)<br /><mark>BOND</mark> Durant votre tour, ce personnage gagne <b>Insaisissable</b>. <i>(Il peut défier les personnages avec Insaisissable.)</i>"", 'flavour': ""“Je ferais n'importe quoi pour sauver mon royaume.“"", 'image': 'https://images.lorcania.com/cards/tfc/189_fr_simba-716.webp'}}"
16,Mickey Mouse,Wayward Sorcerer,4,1,3,4,5,glimmer,"<mark>ANIMATE BROOM</mark> You pay 1 ⬡ less to play Broom characters.<br /><mark>CEASELESS WORKER</mark> Whenever one of your Broom characters is banished in a challenge, you may return that card to your hand.",He always goes for the clean sweep.,pen,2,Nicholas Kole,2,EN,51,204,super_rare,https://images.lorcania.com/cards/tfc/51_en_mickey_mouse-716.webp,L5L.#kIvXk00QP?b~S4-0]Br58^i,19,1,0,2023-04-10T20:07:36.000000Z,2023-04-10T20:07:36.000000Z,"['Dreamborn', 'Sorcerer']",5.37,"{'id': 19, 'name': 'Fantasia', 'slug': 'fantasia', 'brand': None, 'image': 'https://images.lorcania.com/site/franchises/Fantasia.png'}","{'EN': {'card_id': 16, 'language': 'EN', 'name': 'Mickey Mouse', 'title': 'Wayward Sorcerer', 'action': '<mark>ANIMATE BROOM</mark> You pay 1 ⬡ less to play Broom characters.<br />\u2028<mark>CEASELESS WORKER</mark> Whenever one of your Broom characters is banished in a challenge, you may return that card to your hand.', 'flavour': 'He always goes for the clean sweep.', 'image': 'https://images.lorcania.com/cards/tfc/51_en_mickey_mouse-716.webp'}, 'DE': {'card_id': 16, 'language': 'DE', 'name': 'Micky Maus', 'title': 'Eigenwilliger Zauberer', 'action': '<mark>LEBENDIGER BESEN</mark> Du zahlst 1 ⬡ weniger, um Besen auszuspielen.<br />\u2028<mark>UNERMÜDLICHE ARBEITER</mark> Jedes Mal, wenn einer deiner Besen durch eine Herausforderung verbannt wird, darfst du jene Karte zurück auf deine Hand nehmen.', 'flavour': 'Immer für eine saubere Sache zu haben.', 'image': 'https://images.lorcania.com/cards/tfc/51_de_mickey_mouse-716.webp'}, 'FR': {'card_id': 16, 'language': 'FR', 'name': 'Mickey Mouse', 'title': 'Sorcier renégat', 'action': ""<mark>ANIMER LES BALAIS</mark> Les personnages Balai vous coûtent 1 ⬡ de moins à jouer.<br />\u2028<mark>TRAVAILLEUR INFATIGABLE</mark> Si l'un de vos personnages Balai est banni via un défi, vous pouvez le reprendre en main."", 'flavour': 'Les problèmes ? Il les balaie !', 'image': 'https://images.lorcania.com/cards/tfc/51_fr_mickey_mouse-716.webp'}}"
17,Mulan,Imperial Soldier,5,1,4,5,1,glimmer,"<mark>Lead by example</mark> During your turn, whenever this character banishes another character in a challenge, your other characters get +1 ◆ this turn.",,,1,Mel Milton,2,EN,118,204,super_rare,https://images.lorcania.com/cards/tfc/118_en_mulan-716.webp,LPLpR1M~D*W;tWa$rqWVpso0Z%ax,8,1,0,2023-01-17T17:54:23.000000Z,2023-01-17T17:54:23.000000Z,"['Hero', 'Storyborn', 'Princess']",3.83,"{'id': 8, 'name': 'Mulan', 'slug': 'mulan', 'brand': None, 'image': 'https://images.lorcania.com/site%2Ffranchises%2FMulan.png'}","{'EN': {'card_id': 17, 'language': 'EN', 'name': 'Mulan', 'title': 'Imperial Soldier', 'action': '<mark>Lead by example</mark> During your turn, whenever this character banishes another character in a challenge, your other characters get +1 ◆ this turn.', 'flavour': None, 'image': 'https://images.lorcania.com/cards/tfc/118_en_mulan-716.webp'}, 'DE': {'card_id': 17, 'language': 'DE', 'name': 'Mulan', 'title': 'Kaiserliche Soldatin', 'action': '<mark>MIT GUTEM BEISPIELVORAN GEHEN</mark> Jedes Mal, wenn dieser Charakter in deinem Zug durch eine Herausforderung einen anderen Charakter verbannt, erhalten deine anderen Charaktere in diesem Zug je +1 ◆.', 'flavour': None, 'image': 'https://images.lorcania.com/cards/tfc/118_de_mulan-716.webp'}, 'FR': {'card_id': 17, 'language': 'FR', 'name': 'Mulan', 'title': 'Soldat impérial', 'action': '<mark>UN EXEMPLE</mark> Lorsque ce personnage en bannit un autre via un défi,tous vos autres personnages gagnent +1 ◆ pour le reste de ce tour.', 'flavour': None, 'image': 'https://images.lorcania.com/cards/tfc/118_fr_mulan-716.webp'}}"
