id,name,title,cost,inkwell,attack,defence,color,type,action,flavour,separator,stars,illustrator,card_set_id,language,number,pack,rarity,image,blurhash,franchise_id,final,spoiler,created_at,updated_at,traits,prices,franchise,languages
298,Sword In The Stone,,1,0,,,1,item,"↷, 2 ⬡ - Chosen character gets +1 ※ this turn for each 1 damage on them.",“Whoso pulleth out this sword of this stone and anvil is rightwise king born of England.”,book,0,Gaku Kumatori,3,EN,136,204,uncommon,https://images.lorcania.com/cards/rotf/136_en_sword_in_the_stone-716.webp,,23,1,0,2023-10-26T18:23:02.000000Z,2023-10-26T18:23:02.000000Z,['Item'],0,"{'id': 23, 'name': 'The Sword in the Stone', 'slug': 'the-sword-in-the-stone', 'brand': None, 'image': 'https://images.lorcania.com/site/franchises/The_Sword_in_the_Stone.png'}","{'EN': {'card_id': 298, 'language': 'EN', 'name': 'Sword In The Stone', 'title': None, 'action': '↷, 2 ⬡ - Chosen character gets +1 ※ this turn for each 1 damage on them.', 'flavour': '“Whoso pulleth out this sword of this stone and anvil is rightwise king born of England.”', 'image': 'https://images.lorcania.com/cards/rotf/136_en_sword_in_the_stone-716.webp'}, 'DE': {'card_id': 298, 'language': 'DE', 'name': None, 'title': None, 'action': None, 'flavour': None, 'image': 'https://images.lorcania.com/cards/rotf/136_de_sword_in_the_stone-716.webp'}, 'FR': {'card_id': 298, 'language': 'FR', 'name': ""L'Épée dans l'enclume"", 'title': None, 'action': '↷, 2 ⬡ - Choisissez un personnage, il gagne + 1 ※ pour chaque jeton Dommage sur lui, pour le reste de ce tour.', 'flavour': '""Celui qui pourra arracher cette épée de l\'enclume\nscellée dans la pierre sera digne d\'être roi, souverain\nmaître de l\'Angleterre.""', 'image': 'https://images.lorcania.com/cards/rotf/136_fr_sword_in_the_stone-716.webp'}}"
299,Enchantress,Unexpected Judge,2,1,1,1,3,glimmer,"<mark>TRUE FORM</mark> While being challenged, this character gets +2 ※.",Appearances can be deceiving.,pen,2,Isaiah Mesq,3,EN,80,204,common,https://images.lorcania.com/cards/rotf/80_en_enchantress-716.webp,,14,1,0,2023-10-26T20:12:00.000000Z,2023-10-26T20:12:00.000000Z,"['Dreamborn', 'Sorcerer']",2.27,"{'id': 14, 'name': 'Beauty & the Beast', 'slug': 'beauty-and-the-beast', 'brand': None, 'image': 'https://images.lorcania.com/site%2Ffranchises%2FBeauty_and_the_Beast.png'}","{'EN': {'card_id': 299, 'language': 'EN', 'name': 'Enchantress', 'title': 'Unexpected Judge', 'action': '<mark>TRUE FORM</mark> While being challenged, this character gets +2 ※.', 'flavour': 'Appearances can be deceiving.', 'image': 'https://images.lorcania.com/cards/rotf/80_en_enchantress-716.webp'}, 'DE': {'card_id': 299, 'language': 'DE', 'name': None, 'title': None, 'action': None, 'flavour': None, 'image': 'https://images.lorcania.com/cards/rotf/80_de_enchantress-716.webp'}, 'FR': {'card_id': 299, 'language': 'FR', 'name': ""L'Enchanteresse"", 'title': 'Juge inattendue', 'action': '<mark>VÉRITABLE APPARENCE</mark> Tant que le personnage est défié, ce personnage gagne + 2 ※.', 'flavour': 'Les apparences peuvent être trompeuses.', 'image': 'https://images.lorcania.com/cards/rotf/80_fr_enchantress-716.webp'}}"
300,Cobra Bubbles,Simple Educator,7,1,5,9,4,glimmer,,"So if I understand correctly, your “magic” grimoire was washed away by a flood of “magic” ink?",pen,2,Jake Parker,3,EN,4,204,rare,https://images.lorcania.com/cards/rotf/4_en_cobra_bubbles-716.webp,,2,1,0,2023-10-26T20:15:21.000000Z,2023-10-26T20:15:21.000000Z,"['Ally', 'Storyborn']",0,"{'id': 2, 'name': 'Lilo and Stitch', 'slug': 'lilo-and-stitch', 'brand': None, 'image': 'https://images.lorcania.com/site%2Ffranchises%2FLilo_and_Stitch.png'}","{'EN': {'card_id': 300, 'language': 'EN', 'name': 'Cobra Bubbles', 'title': 'Simple Educator', 'action': None, 'flavour': 'So if I understand correctly, your “magic” grimoire was washed away by a flood of “magic” ink?', 'image': 'https://images.lorcania.com/cards/rotf/4_en_cobra_bubbles-716.webp'}, 'DE': {'card_id': 300, 'language': 'DE', 'name': None, 'title': None, 'action': None, 'flavour': None, 'image': 'https://images.lorcania.com/cards/rotf/4_de_cobra_bubbles-716.webp'}, 'FR': {'card_id': 300, 'language': 'FR', 'name': 'Cobra Bubbles', 'title': 'Simple éducateur', 'action': None, 'flavour': '""Donc si je comprends bien, votre grimoire ""magique"" a été emporté par une inondation d\'encre ""magique"" ?', 'image': 'https://images.lorcania.com/cards/rotf/4_fr_cobra_bubbles-716.webp'}}"
301,Mulan,Reflecting,4,1,3,3,4,glimmer,"<b>Shift</b> 2 (<i>You may pay 2 ⬡ to play this on top of one of your characters named Mulan.</i>)<br /><mark>HONOR TO THE ANCESTORS</mark> Whenever this character quests, you may reveal the top card of your deck. If it's a song card, you may play it for free. Otherwise, put it on the top of your deck.",,,2,Lissette Carrera,3,EN,16,204,rare,https://images.lorcania.com/cards/rotf/16_en_mulan-716.webp,,8,1,0,2023-10-26T21:43:29.000000Z,2023-10-26T21:43:29.000000Z,"['Floodborn', 'Hero', 'Princess']",9.88,"{'id': 8, 'name': 'Mulan', 'slug': 'mulan', 'brand': None, 'image': 'https://images.lorcania.com/site%2Ffranchises%2FMulan.png'}","{'EN': {'card_id': 301, 'language': 'EN', 'name': 'Mulan', 'title': 'Reflecting', 'action': ""<b>Shift</b> 2 (<i>You may pay 2 ⬡ to play this on top of one of your characters named Mulan.</i>)<br />\n<mark>HONOR TO THE ANCESTORS</mark> Whenever this character quests, you may reveal the top card of your deck. If it's a song card, you may play it for free. Otherwise, put it on the top of your deck."", 'flavour': None, 'image': 'https://images.lorcania.com/cards/rotf/16_en_mulan-716.webp'}, 'DE': {'card_id': 301, 'language': 'DE', 'name': None, 'title': None, 'action': None, 'flavour': None, 'image': None}, 'FR': {'card_id': 301, 'language': 'FR', 'name': 'Mulan', 'title': 'Réflexion', 'action': ""<b>Alter</b> 2 (<i>Vous pouvez payer 2 ⬡ pour jouer\nl'un de vos personnages Mulan.</i>)<br />\n<mark>HOMMAGE AUX ANCÊTRES</mark> Chaque fois que ce personnage part à l'aventure, vous pouvez révéler la carte du dessus de votre deck. Si c'est une carte de chanson, vous pouvez la jouer gratuitement. Sinon, remettez-la sur le dessus de votre deck."", 'flavour': None, 'image': None}}"
302,Pinocchio,Star Attraction,2,0,1,1,5,glimmer,,"“With that personality, that profile, that physique . . . Why, I can see your name in lights, lights six feet high.” −Honest John",book,3,Kapik,3,EN,56,204,rare,https://images.lorcania.com/cards/rotf/56_en_pinocchio-716.webp,,26,1,0,2023-10-27T13:37:26.000000Z,2023-10-27T13:37:26.000000Z,"['Hero', 'Storyborn']",8.99,"{'id': 26, 'name': 'Pinocchio', 'slug': 'pinocchio', 'brand': None, 'image': 'https://images.lorcania.com/site/franchises/Lorcania.webp'}","{'EN': {'card_id': 302, 'language': 'EN', 'name': 'Pinocchio', 'title': 'Star Attraction', 'action': None, 'flavour': '“With that personality, that profile, that physique . . . \nWhy, I can see your name in lights, lights six feet high.” \n−Honest John', 'image': 'https://images.lorcania.com/cards/rotf/56_en_pinocchio-716.webp'}, 'DE': {'card_id': 302, 'language': 'DE', 'name': None, 'title': None, 'action': None, 'flavour': None, 'image': None}, 'FR': {'card_id': 302, 'language': 'FR', 'name': 'Pinocchio', 'title': 'Attraction Vedette', 'action': None, 'flavour': '""Avec cette personnalité, ce profil, cette silhouette… Pourquoi, je peux voir votre nom en lumières, des lumières de six pieds de haut. ""', 'image': None}}"
303,Prince Naveen,Penniless Royal,3,1,4,3,6,glimmer,,All he's got is his charm.,pen,1,Gaku Kumatori,3,EN,191,204,common,https://images.lorcania.com/cards/rotf/191_en_prince_naveen-716.webp,,22,1,0,2023-10-27T18:33:26.000000Z,2023-10-27T18:33:26.000000Z,"['Prince', 'Storyborn']",2.24,"{'id': 22, 'name': 'The Princess and the Frog', 'slug': 'the-princess-and-the-frog', 'brand': None, 'image': 'https://images.lorcania.com/site/franchises/The_Princess_and_the_Frog.png'}","{'EN': {'card_id': 303, 'language': 'EN', 'name': 'Prince Naveen', 'title': 'Penniless Royal', 'action': None, 'flavour': ""All he's got is his charm."", 'image': 'https://images.lorcania.com/cards/rotf/191_en_prince_naveen-716.webp'}, 'DE': {'card_id': 303, 'language': 'DE', 'name': None, 'title': None, 'action': None, 'flavour': None, 'image': 'https://images.lorcania.com/cards/rotf/191_de_prince_naveen-716.webp'}, 'FR': {'card_id': 303, 'language': 'FR', 'name': 'Prince Naveen', 'title': 'Prince sans moyens', 'action': None, 'flavour': ""Tout ce qu'il possède, c'est son charme"", 'image': 'https://images.lorcania.com/cards/rotf/191_fr_prince_naveen-716.webp'}}"
304,Perplexing Signposts,,2,0,,,5,item,<mark>TO WONDERLAND</mark> Banish this item – Return chosen character of yours to your hand.,"Alice: “I just wanted to ask you which way I ought to go.” Cheshire Cat: “Well, that depends on where you want to get to.”",book,0,Andrew Trabbold,3,EN,67,204,rare,https://images.lorcania.com/cards/rotf/67_en_perplexing_signposts-716.webp,,16,1,0,2023-10-27T18:42:48.000000Z,2023-10-27T18:42:48.000000Z,['Item'],12.87,"{'id': 16, 'name': 'Alice in Wonderland', 'slug': 'alice-in-wonderland', 'brand': None, 'image': 'https://images.lorcania.com/site%2Ffranchises%2FAlice_in_Wonderland.png'}","{'EN': {'card_id': 304, 'language': 'EN', 'name': 'Perplexing Signposts', 'title': None, 'action': '<mark>TO WONDERLAND</mark> Banish this item – Return chosen character of yours to your hand.', 'flavour': 'Alice: “I just wanted to ask you which way I ought to go.” \nCheshire Cat: “Well, that depends on where you want to get to.”', 'image': 'https://images.lorcania.com/cards/rotf/67_en_perplexing_signposts-716.webp'}, 'DE': {'card_id': 304, 'language': 'DE', 'name': None, 'title': None, 'action': None, 'flavour': None, 'image': 'https://images.lorcania.com/cards/rotf/67_de_perplexing_signposts-716.webp'}, 'FR': {'card_id': 304, 'language': 'FR', 'name': 'PANNEAUX CONFUS', 'title': None, 'action': '<mark>VERS LE PAYS DES MERVEILLES</mark> Bannissez cet objet – Renvoyez le personnage de votre choix dans votre main.', 'flavour': 'Alice : ""Je voulais juste vous demander quelle direction prendre.""\nChat du Cheshire : ""Cela dépend de l\'endroit où tu veux aller.""', 'image': 'https://images.lorcania.com/cards/rotf/67_fr_perplexing_signposts-716.webp'}}"
305,Basil,Great Mouse Detective,6,1,3,4,2,glimmer,"<b>Shift</b> 5 <i>You may pay 5 ⬡ to play this on top of one of your characters named Basil.)</i><br /><mark>THERE'S ALWAYS A CHANCE</mark> If you used <b>Shift</b> to play this character, you may draw 2 cards when he enters play.",A solution always presents itself.,pen,3,Bill Robinson,3,EN,138,204,super_rare,https://images.lorcania.com/cards/rotf/138_en_basil-716.webp,,27,1,0,2023-10-28T11:22:45.000000Z,2023-10-28T11:22:45.000000Z,"['Floodborn', 'Hero', 'Detective']",44.86,"{'id': 27, 'name': 'The Great Mouse Detective', 'slug': 'great-mouse-detective', 'brand': None, 'image': 'https://images.lorcania.com/site/franchises/Lorcania.webp'}","{'EN': {'card_id': 305, 'language': 'EN', 'name': 'Basil', 'title': 'Great Mouse Detective', 'action': ""<b>Shift</b> 5 <i>You may pay 5 ⬡ to play this on top of one of your characters named Basil.)</i><br />\n<mark>THERE'S ALWAYS A CHANCE</mark> If you used <b>Shift</b> to play this character, you may draw 2 cards when he enters play."", 'flavour': 'A solution always presents itself.', 'image': 'https://images.lorcania.com/cards/rotf/138_en_basil-716.webp'}, 'DE': {'card_id': 305, 'language': 'DE', 'name': None, 'title': None, 'action': None, 'flavour': None, 'image': 'https://images.lorcania.com/cards/rotf/138_de_basil-716.webp'}, 'FR': {'card_id': 305, 'language': 'FR', 'name': 'Basil', 'title': 'Détective Privé', 'action': ""<b>Alter</b> 5 <i>Vous pouvez payer 5 ⬡ pour jouer ce personnage l'un de vos personnages Basil.)</i><br />\n<mark>IL Y A TOUJOURS UNE CHANCE</mark> Si vous avez utilisé <b>Alter</b>pour jouer ce personnage, vous pouvez piocher 2 cartes quand il entre en jeu."", 'flavour': ""Une solution se présente toujours d'elle-même."", 'image': 'https://images.lorcania.com/cards/rotf/138_fr_basil-716.webp'}}"
306,Basil,Of Baker Street,2,1,2,2,2,glimmer,"<b>Support</b> <i>(Whenever this character quests, you may add their ※ to another chosen character‘s ※ this turn.)</i>","“What an ingenious device! If its light is refracted through these, then its images must resolve somewhere below.”",pen,1,Jake Parker,3,EN,139,204,common,https://images.lorcania.com/cards/rotf/139_en_basil-716.webp,,27,1,0,2023-10-28T14:29:37.000000Z,2023-10-28T14:29:37.000000Z,"['Detective', 'Dreamborn', 'Hero']",2.86,"{'id': 27, 'name': 'The Great Mouse Detective', 'slug': 'great-mouse-detective', 'brand': None, 'image': 'https://images.lorcania.com/site/franchises/Lorcania.webp'}","{'EN': {'card_id': 306, 'language': 'EN', 'name': 'Basil', 'title': 'Of Baker Street', 'action': '<b>Support</b> <i>(Whenever this character quests, you\x03 may add their ※ to another chosen character‘s ※ this turn.)</i>', 'flavour': '“What an ingenious device! If its light is refracted through these, then its images must resolve somewhere below.”', 'image': 'https://images.lorcania.com/cards/rotf/139_en_basil-716.webp'}, 'DE': {'card_id': 306, 'language': 'DE', 'name': None, 'title': None, 'action': None, 'flavour': None, 'image': 'https://images.lorcania.com/cards/rotf/139_de_basil-716.webp'}, 'FR': {'card_id': 306, 'language': 'FR', 'name': 'Basil', 'title': 'De Baker Street', 'action': ""<b>Soutien</b> <i>(Lorsque ce personnage est envoyé à l'aventure, vous pouvez ajouter sa ※ à celle d'un autre personnage au choix pour le reste de ce tour.)</i>"", 'flavour': '""Quel dispositifingénieux ! Si sa lumière est réfractée à travers ceux-ci, alors ses images doivent se résoudre quelque part en dessous.""', 'image': 'https://images.lorcania.com/cards/rotf/139_fr_basil-716.webp'}}"
307,Basil,Perceptive Investigator,3,1,3,4,2,glimmer,,“There is no question: something is afoot in the Great Illuminary.”,pen,2,Roger Perez,3,EN,140,204,common,https://images.lorcania.com/cards/rotf/140_en_basil-716.webp,,27,1,0,2023-10-28T14:32:42.000000Z,2023-10-28T14:32:42.000000Z,"['Detective', 'Hero', 'Storyborn']",2.36,"{'id': 27, 'name': 'The Great Mouse Detective', 'slug': 'great-mouse-detective', 'brand': None, 'image': 'https://images.lorcania.com/site/franchises/Lorcania.webp'}","{'EN': {'card_id': 307, 'language': 'EN', 'name': 'Basil', 'title': 'Perceptive Investigator', 'action': None, 'flavour': '“There is no question: something is afoot in the Great Illuminary.”', 'image': 'https://images.lorcania.com/cards/rotf/140_en_basil-716.webp'}, 'DE': {'card_id': 307, 'language': 'DE', 'name': None, 'title': None, 'action': None, 'flavour': None, 'image': 'https://images.lorcania.com/cards/rotf/140_de_basil-716.webp'}, 'FR': {'card_id': 307, 'language': 'FR', 'name': 'Basil', 'title': 'Enquêteur Perspicace', 'action': None, 'flavour': '""Il n\'y a pas de doute : quelque chose se trame dans le Grand Illuminarium.""', 'image': 'https://images.lorcania.com/cards/rotf/140_fr_basil-716.webp'}}"
308,Queen of Hearts,Capricious Monarch,7,1,5,6,6,glimmer,"<mark>OFF WITH THEIR HEADS!</mark> Whenever an opposing character is banished, you may ready this character.",The fourth Rule of Villainy: Do whatever it takes to get ahead.,pen,1,Jenna Gray,3,EN,192,204,rare,https://images.lorcania.com/cards/rotf/192_en_queen_of_hearts-716.webp,,16,1,0,2023-10-28T14:36:45.000000Z,2023-10-28T14:36:45.000000Z,"['Queen', 'Villain', 'Storyborn']",14.87,"{'id': 16, 'name': 'Alice in Wonderland', 'slug': 'alice-in-wonderland', 'brand': None, 'image': 'https://images.lorcania.com/site%2Ffranchises%2FAlice_in_Wonderland.png'}","{'EN': {'card_id': 308, 'language': 'EN', 'name': 'Queen of Hearts', 'title': 'Capricious Monarch', 'action': '<mark>OFF WITH THEIR HEADS!</mark> Whenever an opposing character is banished, you may ready this character.', 'flavour': 'The fourth Rule of Villainy: Do whatever it takes to get ahead.', 'image': 'https://images.lorcania.com/cards/rotf/192_en_queen_of_hearts-716.webp'}, 'DE': {'card_id': 308, 'language': 'DE', 'name': None, 'title': None, 'action': None, 'flavour': None, 'image': 'https://images.lorcania.com/cards/rotf/192_de_queen_of_hearts-716.webp'}, 'FR': {'card_id': 308, 'language': 'FR', 'name': 'Reine de Coeur', 'title': 'Monarque Capricieux', 'action': ""<mark>AVEC LA TÊTE! </mark> Chaque fois qu'un personnage adverse est banni, vous pouvez redresser ce personnage."", 'flavour': 'La quatrième règle de la vie de bandit : Pour être toujours en tête, parfois tu dois risquer ta vie.', 'image': 'https://images.lorcania.com/cards/rotf/192_fr_queen_of_hearts-716.webp'}}"
309,Eli La Bouff,Big Daddy,4,1,2,5,6,glimmer,,“I don't suppose y'all could whip up some more magical beignets with them inkcasters?”,pen,2,Isaiah Mesq,3,EN,179,204,uncommon,https://images.lorcania.com/cards/rotf/179_en_eli_la_bouff-716.webp,,22,1,0,2023-10-28T14:39:50.000000Z,2023-10-28T14:39:50.000000Z,"['Mentor', 'Storyborn']",2.57,"{'id': 22, 'name': 'The Princess and the Frog', 'slug': 'the-princess-and-the-frog', 'brand': None, 'image': 'https://images.lorcania.com/site/franchises/The_Princess_and_the_Frog.png'}","{'EN': {'card_id': 309, 'language': 'EN', 'name': 'Eli La Bouff', 'title': 'Big Daddy', 'action': None, 'flavour': ""“I don't suppose y'all could whip up some more magical beignets with them inkcasters?”"", 'image': 'https://images.lorcania.com/cards/rotf/179_en_eli_la_bouff-716.webp'}, 'DE': {'card_id': 309, 'language': 'DE', 'name': None, 'title': None, 'action': None, 'flavour': None, 'image': 'https://images.lorcania.com/cards/rotf/179_de_eli_la_bouff-716.webp'}, 'FR': {'card_id': 309, 'language': 'FR', 'name': 'Eli Le Boeuf', 'title': 'Big Daddy', 'action': None, 'flavour': '""Tu ne peux pas simplement invoquer aléatoirement des beignets avec tes créateurs d\'encre ?""', 'image': 'https://images.lorcania.com/cards/rotf/179_fr_eli_la_bouff-716.webp'}}"
310,Ring The Bell,,3,1,,,3,action,Banish chosen damaged character.,"“I’m afraid that you’ve gone and upset me.“ – Ratigan",book,0,Brian Weisz,3,EN,101,204,uncommon,https://images.lorcania.com/cards/rotf/101_en_ring_the_bell-716.webp,,27,1,0,2023-10-29T09:18:44.000000Z,2023-10-29T09:18:44.000000Z,['Action'],2.47,"{'id': 27, 'name': 'The Great Mouse Detective', 'slug': 'great-mouse-detective', 'brand': None, 'image': 'https://images.lorcania.com/site/franchises/Lorcania.webp'}","{'EN': {'card_id': 310, 'language': 'EN', 'name': 'Ring The Bell', 'title': None, 'action': 'Banish chosen damaged character.', 'flavour': '“I’m afraid that you’ve gone and upset me.“ \n– Ratigan', 'image': 'https://images.lorcania.com/cards/rotf/101_en_ring_the_bell-716.webp'}, 'DE': {'card_id': 310, 'language': 'DE', 'name': None, 'title': None, 'action': None, 'flavour': None, 'image': 'https://images.lorcania.com/cards/rotf/101_de_ring_the_bell-716.webp'}, 'FR': {'card_id': 310, 'language': 'FR', 'name': 'Sonner la cloche', 'title': None, 'action': 'Choisissez un personnage ayant au moins un jeton dommage et bannissez le.', 'flavour': '""J\'ai bien peur que tu m\'aies contrarié.""\n− Ratigan', 'image': 'https://images.lorcania.com/cards/rotf/101_fr_ring_the_bell-716.webp'}}"
311,Mrs. Judson,Housekeeper,4,0,1,5,2,glimmer,"<mark>TIDY UP</mark> Whenever you play a Floodborn character, you may put the top card of your deck into your inkwell facedown and exerted.",“I know just the thing. Let me fetch you a pot of tea and some of my fresh cheese crumpets.“,book,2,Michaela Martin,3,EN,153,204,rare,https://images.lorcania.com/cards/rotf/153_en_mrs_judson-716.webp,,27,1,0,2023-10-29T15:19:50.000000Z,2023-10-29T15:19:50.000000Z,"['Ally', 'Storyborn']",12.87,"{'id': 27, 'name': 'The Great Mouse Detective', 'slug': 'great-mouse-detective', 'brand': None, 'image': 'https://images.lorcania.com/site/franchises/Lorcania.webp'}","{'EN': {'card_id': 311, 'language': 'EN', 'name': 'Mrs. Judson', 'title': 'Housekeeper', 'action': '<mark>TIDY UP</mark> Whenever you play a Floodborn character, you may put the top card of your deck into your inkwell facedown and exerted.', 'flavour': '“I know just the thing. Let me fetch you a pot of tea and some of my fresh cheese crumpets.“', 'image': 'https://images.lorcania.com/cards/rotf/153_en_mrs_judson-716.webp'}, 'DE': {'card_id': 311, 'language': 'DE', 'name': None, 'title': None, 'action': None, 'flavour': None, 'image': 'https://images.lorcania.com/cards/rotf/153_de_mrs_judson-716.webp'}, 'FR': {'card_id': 311, 'language': 'FR', 'name': 'Mrs. Judson', 'title': 'Gouvernante', 'action': '<mark>NETTOYAGE</mark> Chaque fois que vous jouez un personnage Floodborn, vous pouvez mettre la carte du dessus de votre deck dans votre encrier, face cachée et épuisée.', 'flavour': '""Je sais exactement ce qu\'il vous faut. Laissez-moi vous\nchercher une théière et quelques-uns de mes crumpets au\nfromage frais.', 'image': 'https://images.lorcania.com/cards/rotf/153_fr_mrs_judson-716.webp'}}"
312,Belle,Bookworm,3,0,2,4,3,glimmer,"<mark>USE YOUR IMAGINATION</mark> While an opponent has no cards in their hand, this character gets +2 ◆.",There's nothing more tempting than a pile of unread books.,pen,1,Jenna Gray,3,EN,71,204,uncommon,https://images.lorcania.com/cards/rotf/71_en_belle-716.webp,,14,1,0,2023-10-30T16:57:07.000000Z,2023-10-30T16:57:07.000000Z,"['Hero', 'Princess', 'Storyborn']",5.86,"{'id': 14, 'name': 'Beauty & the Beast', 'slug': 'beauty-and-the-beast', 'brand': None, 'image': 'https://images.lorcania.com/site%2Ffranchises%2FBeauty_and_the_Beast.png'}","{'EN': {'card_id': 312, 'language': 'EN', 'name': 'Belle', 'title': 'Bookworm', 'action': '<mark>USE YOUR IMAGINATION</mark> While an opponent has no cards in their hand, this character gets +2 ◆.', 'flavour': ""There's nothing more tempting than a pile of unread books."", 'image': 'https://images.lorcania.com/cards/rotf/71_en_belle-716.webp'}, 'DE': {'card_id': 312, 'language': 'DE', 'name': None, 'title': None, 'action': None, 'flavour': None, 'image': 'https://images.lorcania.com/cards/rotf/71_de_belle-716.webp'}, 'FR': {'card_id': 312, 'language': 'FR', 'name': None, 'title': None, 'action': None, 'flavour': None, 'image': 'https://images.lorcania.com/cards/rotf/71_fr_belle-716.webp'}}"
313,Pack Tactics,,4,1,,,3,action,Gain 1 lore for each damaged character opponents have in play.,"Pacha: “You want to survive the jungle? Start thinking like you belong here.” Kuzco: “No problem . . . Grrr, look at me, I'm a jaguar.”",pen,0,Don Aguillo,3,EN,100,204,rare,https://images.lorcania.com/cards/rotf/100_en_pack_tactics-716.webp,,20,1,0,2023-10-31T10:53:53.000000Z,2023-10-31T10:53:53.000000Z,['Action'],13.86,"{'id': 20, 'name': ""The Emperor's New Groove"", 'slug': 'the-emperors-new-groove', 'brand': None, 'image': 'https://images.lorcania.com/site/franchises/Emperors_New_Groove.png'}","{'EN': {'card_id': 313, 'language': 'EN', 'name': 'Pack Tactics', 'title': None, 'action': 'Gain 1 lore for each damaged character opponents have in play.', 'flavour': ""Pacha: “You want to survive the jungle? Start thinking like you belong here.” \nKuzco: “No problem . . . Grrr, look at me, I'm a jaguar.”"", 'image': 'https://images.lorcania.com/cards/rotf/100_en_pack_tactics-716.webp'}, 'DE': {'card_id': 313, 'language': 'DE', 'name': None, 'title': None, 'action': None, 'flavour': None, 'image': None}, 'FR': {'card_id': 313, 'language': 'FR', 'name': None, 'title': None, 'action': None, 'flavour': None, 'image': None}}"
314,Gumbo Pot,,2,1,,,2,item,<mark>THE BEST I'VE EVER TASTED</mark> ↷ − Remove 1 damage each from up to 2 chosen characters.,"“A gift this special just got to be shared.” −James",book,0,Tanisha Cherislin,3,EN,167,204,common,https://images.lorcania.com/cards/rotf/167_en_gumbo_pot-716.webp,,22,1,0,2023-10-31T11:07:53.000000Z,2023-10-31T11:07:53.000000Z,['Item'],3.86,"{'id': 22, 'name': 'The Princess and the Frog', 'slug': 'the-princess-and-the-frog', 'brand': None, 'image': 'https://images.lorcania.com/site/franchises/The_Princess_and_the_Frog.png'}","{'EN': {'card_id': 314, 'language': 'EN', 'name': 'Gumbo Pot', 'title': None, 'action': ""<mark>THE BEST I'VE EVER TASTED</mark> ↷ − Remove 1 damage each from up to 2 chosen characters."", 'flavour': '“A gift this special just got to be shared.” \n−James', 'image': 'https://images.lorcania.com/cards/rotf/167_en_gumbo_pot-716.webp'}, 'DE': {'card_id': 314, 'language': 'DE', 'name': None, 'title': None, 'action': None, 'flavour': None, 'image': 'https://images.lorcania.com/cards/rotf/167_de_gumbo_pot-716.webp'}, 'FR': {'card_id': 314, 'language': 'FR', 'name': None, 'title': None, 'action': None, 'flavour': None, 'image': 'https://images.lorcania.com/cards/rotf/167_fr_gumbo_pot-716.webp'}}"
